emoji	keywords
ЁЯУФ	book, cover, decorated, decorative, education, notebook, school, writing, роЕроЯрпНроЯрпИ, роЕро┤роХро╛рой, роОро┤рпБродрпНродрпБ, роХро╡ро░рпН, роирпЛроЯрпНроЯрпБ, роирпЛроЯрпНрокрпБроХрпН, рокро│рпНро│ро┐, рокрпБродрпНродроХроорпН, рокрпКро░рпБро│рпН, рокрпЛроЯрокрпНрокроЯрпНроЯ, ро╡роХрпБрокрпНрокрпБ, ро╡рпЗро▓рпИрокрпНрокро╛роЯро╛рой
ЁЯУХ	book, closed, education, роХро▓рпНро▓рпВро░ро┐, роиро╛ро╡ро▓рпН, рокро│рпНро│ро┐, рокрпБродрпНродроХроорпН, рокрпКро░рпБро│рпН, роорпВроЯро┐роп, ро╡ро╛роЪро┐рокрпНрокрпБ
ЁЯУЦ	book, education, fantasy, knowledge, library, novel, novels, open, reading, роЕро▒ро┐ро╡рпБ, роХро▓рпНро▓рпВро░ро┐, роХро▓рпНро╡ро┐, родро┐ро▒роирпНрод, роиро╛ро╡ро▓рпН, рокроЯро┐рокрпНрокрпБ, рокро│рпНро│ро┐, рокрпБроХрпН, рокрпБродрпНродроХроорпН, рокрпКро░рпБро│рпН, ро╡ро╛роЪро┐рокрпНрокрпБ
ЁЯУЧ	book, education, fantasy, green, library, reading, роХро▓рпНро▓рпВро░ро┐, роХро▓рпНро╡ро┐, роиро╛ро╡ро▓рпН, роирпВро▓роХроорпН, рокроЪрпНроЪрпИ, рокро│рпНро│ро┐, рокрпБроХрпН, рокрпБродрпНродроХроорпН, рокрпКро░рпБро│рпН, ро▓рпИрокрпНро░ро░ро┐, ро╡ро╛роЪро┐рокрпНрокрпБ
ЁЯУШ	blue, book, education, fantasy, library, reading, роХро▓рпНро╡ро┐, роирпАро▓рокрпН, роирпВро▓роХроорпН, рокроЯро┐рокрпНрокрпБ, рокро│рпНро│ро┐, рокрпБродрпНродроХроорпН, рокрпКро░рпБро│рпН, ро▓рпИрокрпНро░ро░ро┐, ро╡ро╛роЪро┐рокрпНрокрпБ
ЁЯУЩ	book, education, fantasy, library, orange, reading, роЖро░роЮрпНроЪрпБ, роХро▓рпНро╡ро┐, роирпВро▓роХроорпН, рокроЯро┐рокрпНрокрпБ, рокрпБродрпНродроХроорпН, рокрпКро░рпБро│рпН, ро▓рпИрокрпНро░ро░ро┐, ро╡ро╛роЪро┐рокрпНрокрпБ
ЁЯУЪя╕П	book, books, education, fantasy, knowledge, library, novel, novels, reading, school, study, роЕро▒ро┐ро╡рпБ, роХро▓рпНро▓рпВро░ро┐, роХро▓рпНро╡ро┐, роирпВро▓роХроорпН, рокроЯро┐рокрпНрокрпБ, рокро│рпНро│ро┐, рокрпБродрпНродроХроЩрпНроХро│рпН, рокрпБродрпНродроХроорпН, ро▓рпИрокрпНро░ро░ро┐, ро╡ро╛роЪро┐рокрпНрокрпБ
ЁЯУЬ	paper, scroll, роОро┤рпБродрпНродрпБ, роУро▓рпИ, роХроЯро┐родроорпН, роЪрпБро░рпБроЯрпНроЯрпБ, роЪрпБро░рпБро│рпН, родроХро╡ро▓рпН, родрпКроЯро░рпНрокрпБ, рокрпЗрокрпНрокро░рпИ, рокрпКро░рпБро│рпН, ро╕рпНроХрпНро░рпЛро▓рпН
ЁЯУЭ	communication, media, memo, note, notes, pencil, роХроЯро┐родроорпН, роХрпБро▒ро┐рокрпНрокрпБ, роХрпБро▒ро┐рокрпНрокрпБрокрпН, родроХро╡ро▓рпН, родрпКроЯро░рпНрокрпБ, роирпЛроЯрпН, рокрпБродрпНродроХроорпН, рокрпЖройрпНроЪро┐ро▓рпН, рокрпКро░рпБро│рпН, роорпАроЯро┐ропро╛, роорпЖроорпЛ
ЁЯУЮ	communication, phone, receiver, telephone, voip, роЕро┤рпИ, роЕро┤рпИрокрпНрокрпБ, роЯрпЖро▓ро┐рокрпЛройрпН, родроХро╡ро▓рпН, родрпКроЯро░рпНрокрпБ, родрпКроЯро░рпНрокрпБроХрпКро│рпН, родрпКро▓рпИрокрпЗроЪро┐, рокрпКро░рпБро│рпН, ро░ро┐роЪрпАро╡ро░рпН
ЁЯУЯя╕П	communication, pager, роЪрпЖропрпНродро┐, родроХро╡ро▓рпН, родрпКроЯро░рпНрокрпБ, рокрпЗроЬро░рпН, рокрпКро░рпБро│рпН
ЁЯУа	communication, fax, machine, роГрокрпЗроХрпНро╕рпН, роЗропроирпНродро┐ро░роорпН, родроХро╡ро▓рпН, родрпКроЯро░рпНрокрпБ, родрпКроЯро░рпНрокрпБроХрпКро│рпН, родрпКро▓рпИроироХро▓ро┐, родрпКро▓рпИроироХро▓рпН, рокрпЗроХрпНро╕рпН
ЁЯУб	alien, aliens, antenna, contact, dish, satellite, science, роЖрогрпНроЯрпЖройро╛, роЖройрпНроЯройро╛, роХрпЛро│рпН, роЪро╛роЯрпНроЯро┐ро▓рпИроЯрпН, роЪрпЖропро▒рпНроХрпИ, роЪрпЖропро▒рпНроХрпИроХрпНроХрпЛро│рпН, роЯро┐ро╡ро┐, роЯро┐ро╖рпН, родрпКроЯро░рпНрокрпБ
ЁЯУв	addres, address, communication, loud, loudspeaker, public, sound, роЕро▒ро┐ро╡ро┐рокрпНрокрпБ, роТро▓ро┐рокрпНрокрпЖро░рпБроХрпНроХро┐, роЪрпЖропрпНродро┐, родроХро╡ро▓рпН, родрпКроЯро░рпНрокрпБ, рокрпКродрпБ, ро▓ро╡рпБроЯрпН, ро╕рпНрокрпАроХрпНроХро░рпН
ЁЯУг	cheering, megaphone, sound, роЙро▒рпНроЪро╛роХроорпН, роХрпВро╡рпБродро▓рпН, роЪро┐ропро░ро┐роЩрпН, родрпКроЯро░рпНрокрпБ, роорпЖроХро╛рокрпЛройрпН
ЁЯУдя╕П	box, email, letter, mail, outbox, sent, tray, роЕроЮрпНроЪро▓рпН, роЕройрпБрокрпНрокрокрпНрокроЯрпНроЯродрпБ, роЕро╡рпБроЯрпНрокро╛роХрпНро╕рпН, роХроЯро┐родроорпН, родроЯрпНроЯрпБ, рокрпЖроЯрпНроЯро┐, рооро┐ройрпНройроЮрпНроЪро▓рпН
ЁЯУея╕П	box, email, inbox, letter, mail, receive, tray, zero, роЕроЮрпНроЪро▓рпН, роЗройрпНрокро╛роХрпНро╕рпН, родроЯрпНроЯрпБ, рокрпЖроЯрпНроЯро┐, рокрпЖро▒рпБродро▓рпН
ЁЯУжя╕П	box, communication, delivery, package, parcel, shipping, роЯрпЖро▓ро┐ро╡ро░ро┐, рокро╛роХрпНро╕рпН, рокро╛ро░рпНроЪро▓рпН, рокрпЖроЯрпНроЯро┐, рокрпЗроХрпН, рокрпЗроХрпНроХрпЗроЬрпН, рокрпКро░рпБро│рпН, ро╖ро┐рокрпНрокро┐роЩрпН
ЁЯУз	email, letter, mail, роЕроЮрпНроЪро▓рпН, роЗроорпЖропро┐ро▓рпН, роИроорпЖропро┐ро▓рпН, роХроЯро┐родроорпН, роЪро┐ройрпНройроорпН, роЪро┐роорпНрокро▓рпН, родроХро╡ро▓рпН, родрпКроЯро░рпНрокрпБ, рооро┐ройрпН, рооро┐ройрпНройроЮрпНроЪро▓рпН
ЁЯУи	delivering, email, envelope, incoming, letter, mail, receive, sent, роЕроЮрпНроЪро▓рпН, роЙро▒рпИ, роХроЯро┐род, роХроЯро┐родроорпН, рокрпЖро▒рокрпНрокроЯрпНроЯ, рокрпЖро▒рпНро▒, рооро┐ройрпНройроЮрпНроЪро▓рпН, рооро┐ройрпНройрогрпБ, роорпЖропро┐ро▓рпН, ро╡роирпНрод
ЁЯУй	arrow, communication, down, email, envelope, letter, mail, outgoing, send, sent, роЕроЮрпНроЪро▓рпН, роЕройрпБрокрпНрокрокрпНрокроЯрпНроЯродрпБ, роЕройрпБрокрпНрокро┐роп, роЕроорпНрокрпБроХрпНроХрпБро▒ро┐ропрпБроЯройрпН, роЙро▒рпИ, роХроЯро┐род, роХроЯро┐родроорпН, родроХро╡ро▓рпН, родрпКроЯро░рпНрокрпБ, рокрпЛрой, рооро┐ройрпНройроЮрпНроЪро▓рпН, рооро┐ройрпНройрогрпБ, роорпЖропро┐ро▓рпН, ро╡рпЖро│ро┐роЪрпНроЪрпЖро▓рпНро▓рпБроорпН
ЁЯУкя╕П	closed, flag, lowered, mail, mailbox, postbox, роЕроЮрпНроЪро▓рпН, роЗро▓рпНро▓рпИ, роОродрпБро╡рпБрооро┐ро▓рпНро▓ро╛род, роХроЯро┐родроорпН, роХрпКроЯро┐, роЪро╛ропрпНроирпНрод, родрокро╛ро▓рпН, рокрпЖроЯрпНроЯро┐, роорпВроЯро┐ропродрпБ
ЁЯУля╕П	closed, communication, flag, mail, mailbox, postbox, raised, роЕроЮрпНроЪро▓рпН, роЗро░рпБрокрпНрокродрпИроХрпН, роХро╛роЯрпНроЯрпБроорпН, роХрпКроЯро┐рокро▒роХрпНроХрпБроорпН, родрокро╛ро▓рпН, рокро╛роХрпНро╕рпН, рокрпЖроЯрпНроЯро┐, роорпВроЯро┐роп, роорпЖропро┐ро▓рпН
ЁЯУмя╕П	flag, mail, mailbox, open, postbox, raised, роЕроЮрпНроЪро▓рпБроЯройрпН, роЕроЮрпНроЪро▓рпН, роЗро░рпБроХрпНроХрпБроорпН, роХроЯро┐родроорпН, роХрпКроЯро┐рокро▒роХрпНроХрпБроорпН, родрокро╛ро▓рпН, родро┐ро▒роХрпНроХрокрпНрокроЯрпНроЯ, родро┐ро▒роирпНрод, роиро┐ро▓рпИропро┐ро▓рпН, рокро╛роХрпНро╕рпН, рокрпЖроЯрпНроЯро┐, рокрпКро░рпБро│рпН, роорпЖропро┐ро▓рпН
ЁЯУня╕П	flag, lowered, mail, mailbox, open, postbox, роЕроЮрпНроЪро▓рпН, роЗро░рпБроХрпНроХрпБроорпН, роОродрпБро╡рпБрооро┐ро▓рпНро▓ро╛род, роХрпКроЯро┐роЪро╛ропрпНроирпНрод, родрокро╛ро▓рпН, родро┐ро▒роирпНрод, роиро┐ро▓рпИропро┐ро▓рпН, рокро╛роХрпНро╕рпН, рокрпЖроЯрпНроЯро┐, рокрпКро░рпБро│рпН, роорпЖропро┐ро▓рпН
ЁЯУо	mail, mailbox, postbox, роЕроЮрпНроЪро▓рпН, роХроЯро┐родроорпН, родрокро╛ро▓рпН, рокрпЖроЯрпНроЯро┐, рокрпКро░рпБро│рпН, рокрпЛро╕рпНроЯрпН, рокрпЛро╕рпНроЯрпНрокро╛роХрпНро╕рпН, роорпЖропро┐ро▓рпН
ЁЯУп	horn, post, postal, рокрпКро░рпБро│рпН, рокрпЛро╕рпНроЯро▓рпН, ро╣ро╛ро░рпНройрпН
ЁЯУ░	communication, new, news, newspaper, paper, роЪрпЖропрпНродро┐роХро│рпН, роЪрпЖропрпНродро┐родрпНродро╛ро│рпН, роиро╛ро│рпЗроЯрпБ, роиро┐ропрпВро╕рпН, рокрпЗрокрпНрокро░рпН, рокрпКро░рпБро│рпН
ЁЯУ▒	cell, communication, mobile, phone, telephone, роГрокрпЛройрпН, роЪрпЖро▓рпН, роЪрпЖро▓рпНрокрпЗроЪро┐, роЪрпЖро▓рпНрокрпЛройрпН, родроХро╡ро▓рпН, родрпКроЯро░рпНрокрпБ, рокрпКро░рпБро│рпН, роорпКрокрпИро▓рпН
ЁЯУ▓	arrow, build, call, cell, communication, mobile, phone, receive, telephone, роГрокрпЛройрпН, роЕроорпНрокрпБроХрпНроХрпБро▒ро┐, роЕроорпНрокрпБроХрпНроХрпБро▒ро┐ропрпБроЯройрпН, роЕро┤рпИ, роЕро┤рпИрокрпНрокрпБ, роЪрпЖро▓рпНроГрокрпЛройрпН, роЪрпЖро▓рпНрокрпЛройрпН, родроХро╡ро▓рпН, родрпКроЯро░рпНрокрпБ, рокрпЖро▒рпБродро▓рпН, рокрпКро░рпБро│рпН, роорпКрокрпИро▓рпН
ЁЯУ╖я╕П	camera, photo, selfie, snap, tbt, trip, video, роЗройрпНро╕рпНроЯро╛роХро┐ро░ро╛роорпН, роХрпЗрооро░ро╛, роиро┐ройрпИро╡рпБ, рокроЯроорпН, рокрпБроХрпИрокрпНрокроЯроорпН, рокрпКро░рпБро│рпН, ро╡рпАроЯро┐ропрпЛ, ро╕рпНройро╛рокрпН
ЁЯУ╕	camera, flash, video, роГрокро┐ро│ро╛ро╖рпН, роГрокрпНро│ро╛ро╖рпН, роЕроЯро┐роХрпНроХрпБроорпН, роХрпЗрооро░ро╛, рокро┐ро│ро╛ро╖рпН, ро╡рпАроЯро┐ропрпЛ
ЁЯУ╣я╕П	camcorder, camera, tbt, video, роХро╛роорпН, роХро╛ро░рпНроЯро░рпН, роХрпЗрооро░ро╛, роХрпЗроорпН, роЯро┐рокро┐роЯро┐, ро╡рпАроЯро┐ропрпЛ
ЁЯУ║я╕П	television, tv, video, роЪрпАро░ро┐ропро▓рпН, роЯро┐ро╡ро┐, роЯрпЖро▓ро┐ро╡ро┐ро╖ройрпН, родро┐ро░рпИрокрпНрокроЯроорпН, родрпКро▓рпИроХрпНроХро╛роЯрпНроЪро┐
ЁЯУ╗я╕П	entertainment, radio, tbt, video, роОроГрокрпН, роОрокрпНроОроорпН, роОроорпН, роХрпЗро░ро╡ройрпН, роЪрпЖропрпНродро┐, рокро╛роЯро▓рпН, рокро╛роЯрпНроЯрпБ, ро░рпЗроЯро┐ропрпЛ, ро╡ро╛ройрпКро▓ро┐
ЁЯУ╝	old, school, tape, vcr, vhs, video, videocassette, роХрпЗроЪроЯрпН, роХрпЗро╕роЯрпН, роЯрпЗрокрпН, роиро┐ройрпИро╡рпБроХро│рпН, рокро┤рпИроп, ро╡ро┐ро╣рпЖроЪрпНроОро╕рпН, ро╡рпАроЯро┐ропрпЛ
ЁЯУ┐	bead, beads, clothing, necklace, prayer, religion, роЕрогро┐роХро▓ройрпН, роЙроЯрпИ, роЬрпЖрокрооро╛ро▓рпИ, роЬрпЖрокроорпН, роирпЖроХрпНро▓ро╕рпН, рокропройрпНрокроЯрпБроорпН, рокро╛роЪро┐роорогро┐роХро│рпН, рокро┐ро░ро╛ро░рпНродрпНродройрпИ, рокро┐ро░ро╛ро░рпНродрпНродройрпИроХрпНроХро╛рой, рокрпКро░рпБро│рпН, роорогро┐роХро│рпН, роородроорпН, рооро╛ро▓рпИ, ро╡ро┤ро┐рокроЯрпБро╡родро▒рпНроХрпБрокрпН
ЁЯФЗ	mute, muted, quiet, silent, sound, speaker, роЕрогрпИ, роЕроорпИродро┐, роЖроГрокрпН, роТро▓ро┐ропроЯроХрпНроХрпБ, роТро▓ро┐ропрпИ, роЪрпИро▓ройрпНро╕рпН, роиро┐роЪрокрпНродроорпН, рокрпКро░рпБро│рпН, ро╕рпНрокрпАроХрпНроХро░рпН
ЁЯФИя╕П	low, soft, sound, speaker, volume, роЗро░рпИроЪрпНроЪро▓рпН, роТро▓ро┐, роТро▓ро┐рокрпНрокрпЖро░рпБроХрпНроХро┐, роХрпБро▒рпИроирпНрод, роЪродрпНродроорпН, роЪро╡рпБрогрпНроЯрпН, рокрпЗроЪрпБ, рокрпКро░рпБро│рпН, ро╕рпНрокрпАроХрпНроХро░рпН
ЁЯФЙ	medium, sound, speaker, volume, роЖройрпН, роТро▓ро┐, роТро▓ро┐рокрпНрокрпЖро░рпБроХрпНроХро┐, роХрпБро▒рпИроирпНрод, роЪро╡рпБрогрпНроЯрпН, роироЯрпБродрпНродро░, рокрпЗроЪрпБ, рокрпКро░рпБро│рпН, роорпЖродрпБро╡ро╛роХ, ро╕рпНрокрпАроХрпНроХро░рпН
ЁЯФК	high, loud, music, sound, speaker, volume, роЕро▓ро▒рпБроорпН, роЗро░рпИроЪрпНроЪро▓рпН, роЪродрпНродрооро╛роХрокрпН, роЪро╡рпБрогрпНроЯрпН, рокрпЗроЪрпБ, рокрпКро░рпБро│рпН, ро╕рпНрокрпАроХрпНроХро░рпН, ро╣рпИрокро┐роЯрпНроЪрпН
ЁЯФЛ	battery, роОройро░рпНроЬро┐, рокрпЗроЯрпНроЯро░ро┐, рооро┐ройрпНроХро▓роорпН, рооро┐ройрпНроЪроХрпНродро┐
ЁЯФМ	electric, electricity, plug, рокро╛ропро┐ройрпНроЯрпН, рокро┐ройрпН, рокро┐ро│роХрпН, рокро┐ро│роХрпНроХрпБ, рооро┐ройрпНроЪро╛ро░, рооро┐ройрпНроЪро╛ро░роорпН
ЁЯФНя╕П	glas, glass, lab, left, magnifying, pointing, science, search, tilted, tool, роЕро▒ро┐ро╡ро┐ропро▓рпН, роЗроЯродрпБ, роЙро░рпБрокрпНрокрпЖро░рпБроХрпНроХро┐, роХро░рпБро╡ро┐, роЪро╛ропрпНро╡рпБ, родрпЗроЯро▓рпН, родрпЗроЯрпБ, рокрпЖро░ро┐родро╛роХрпНроХроорпН, ро▓рпЖройрпНро╕рпН
ЁЯФО	contact, glas, glass, lab, magnifying, pointing, right, science, search, tilted, tool, роЕро▒ро┐ро╡ро┐ропро▓рпН, роЖропрпНро╡рпБ, роЙро░рпБрокрпНрокрпЖро░рпБроХрпНроХро┐, роХро░рпБро╡ро┐, роЪро╛ропрпНро╡рпБ, родрпЗроЯро▓рпН, родрпЗроЯрпБ, ро▓рпЖройрпНро╕рпН, ро╡ро▓родрпБ
ЁЯФП	ink, lock, locked, nib, pen, privacy, роЕроирпНродро░роЩрпНроХроорпН, роЙро░ро┐роорпИ, роОройродрпБро░ро┐роорпИ, родройро┐ропрпБро░ро┐роорпИ, рокрпВроЯрпНроЯрпБ, рокрпЗройро╛, рокрпЗройро╛ро╡рпБроЯройрпН
ЁЯФР	bike, closed, key, lock, locked, secure, роХрпА, роЪро╛ро╡ро┐, роЪро╛ро╡ро┐ропрпБроорпН, рокро╛родрпБроХро╛роХрпНроХрокрпНрокроЯрпНроЯродрпБ, рокро╛родрпБроХро╛рокрпНрокро╛ройродрпБ, рокро╛родрпБроХро╛рокрпНрокрпБ, рокрпВроЯрпНроЯрпБ, рокрпВроЯрпНроЯрпБроорпН, рокрпКро░рпБро│рпН, роорпВроЯрокрпНрокроЯрпНроЯродрпБ, ро▓ро╛роХрпН
ЁЯФС	key, keys, lock, major, password, unlock, роХроЯро╡рпБроЪрпНроЪрпКро▓рпН, роЪро╛ро╡ро┐, родро┐ро▒, родро┐ро▒ро╡рпБроХрпЛро▓рпН, рокро╛ро╕рпНро╡рпЗро░рпНроЯрпН, рокрпВроЯрпНроЯрпБ, рокрпВроЯрпНроЯрпБродрпН, рокрпКро░рпБро│рпН
ЁЯФТя╕П	closed, lock, locked, private, роЕроирпНродро░роЩрпНроХроорпН, родройро┐рокрпНрокроЯрпНроЯродрпБ, рокрпВроЯрпНроЯро┐ропродрпБ, рокрпВроЯрпНроЯрпБ, рокрпВроЯрпНроЯрпБродро▓рпН, ро▓ро╛роХрпН
ЁЯФУя╕П	cracked, lock, open, unlock, unlocked, родро┐ро▒роХрпНроХрокрпНрокроЯрпНроЯродрпБ, родро┐ро▒роирпНрод, родро┐ро▒роирпНродродрпБ, рокрпВроЯрпНроЯро╛родродрпБ, рокрпВроЯрпНроЯрпБ, рокрпКро░рпБро│рпН
ЁЯФФ	bell, break, church, sound, роЗроЯрпИро╡рпЗро│рпИ, роТро▓ро┐, роУроЪрпИ, роХрпЛропро┐ро▓рпН, роХрпЛро╡ро┐ро▓рпН, роЪро░рпНроЪрпН, родрпЗро╡ро╛ро▓ропроорпН, рокрпЖро▓рпН, роорогро┐, роорогро┐ропрпКро▓ро┐, роорогро┐ропрпЛроЪрпИ
ЁЯФХ	bell, forbidden, mute, no, not, prohibited, quiet, silent, slash, sound, роЕроЯроХрпНроХрпБ, роЕроорпИродро┐, роТро▓ро┐, роЪродрпНродрооро┐роЯро╛родрпЗ, роЪродрпНродроорпН, родроЯрпИ, роиро┐роЪрокрпНродроорпН, рокрпЛроЯроХрпНроХрпВроЯро╛родрпБ, роорогро┐
ЁЯФЦ	bookmark, mark, роЕроЯрпИропро╛ро│роорпН, роЯрпЗроХрпН, рокроХрпНроХ, рокроЯрпНроЯро┐, рокрпБроХрпНрооро╛ро░рпНроХрпН, рокрпБродрпНродроХроХрпНроХрпБро▒ро┐, рокрпБродрпНродроХроорпН, рокрпКро░рпБро│рпН
ЁЯФЧ	link, links, роЗрогрпИ, роЗрогрпИрокрпНрокрпБ, роЗро░рпБ, роХроЯрпНроЯрпБ, роЪрпЗро░рпН, рокрпКро░рпБро│рпН, ро▓ро┐роЩрпНроХрпН, ро╡ро│рпИропроЩрпНроХро│рпН, ро╡ро│рпИропроорпН
ЁЯФе	af, burn, fire, flame, hot, lit, litaf, tool, роОро░ро┐родро▓рпН, родрпА, роирпЖро░рпБрокрпНрокрпБ
ЁЯФж	electric, flashlight, light, tool, torch, роЗро░ро╡рпБ, роЯро╛ро░рпНроЪрпН, рокро┐ро│ро╛ро╖рпН, рокрпЗроЯрпНроЯро░ро┐, рокрпКро░рпБро│рпН, ро▓рпИроЯрпН, ро╡ро┐ро│роХрпНроХрпБ, ро╡рпЖро│ро┐роЪрпНроЪроорпН
ЁЯФз	home, improvement, spanner, tool, wrench, роЗроЯрпБроХрпНроХро┐, роХро░рпБро╡ро┐, роХрпБро▒роЯрпБ, роЯрпВро▓рпН, родро┐ро░рпБроХро┐, родро┐ро░рпБроХрпБ, рокрпКро░рпБро│рпН, ро╕рпНрокрпЗройро░рпН
ЁЯФи	hammer, home, improvement, repair, repairs, tool, роЖрогро┐, роХро░рпБро╡ро┐, роЪро░ро┐роЪрпЖропрпНродро▓рпН, роЪрпБродрпНродро┐, роЪрпБродрпНродро┐ропро▓рпН, рокро┤рпБродрпБ, рокрпКро░рпБро│рпН, роорпЗроорпНрокро╛роЯрпБ, ро░ро┐рокрпНрокрпЗро░рпН, ро╡рпАроЯрпНроЯрпБ
ЁЯФй	bolt, home, improvement, nut, tool, роХро░рпБро╡ро┐, роироЯрпНроЯрпБ, роироЯрпНроЯрпБроорпН, рокрпЛро▓рпНроЯрпН, рокрпЛро▓рпНроЯрпНроЯрпБроорпН, рооро▒рпНро▒рпБроорпН
ЁЯФк	chef, cooking, hocho, kitchen, knife, tool, weapon, роЖропрпБродроорпН, роЙрогро╡рпБ, роХродрпНродро┐, роХро╛ропрпНроХро▒ро┐, роЪроорпИропро▓рпН, роЪрпЖроГрокрпН, ро╡рпЖроЯрпНроЯрпБ, ро╡рпЖроЯрпНроЯрпБродро▓рпН
