emoji	keywords
ЁЯзЙ	drink, mate, роХрпБро│ро┐ро░рпНрокро╛ройроорпН, роЬрпВро╕рпН, рокро╛ройроорпН, роорпЗроЯрпН
ЁЯзК	cold, cube, ice, iceberg, роРро╕рпН, роХроЯрпНроЯро┐, роХро┐ропрпВрокрпН, роХрпБро│ро┐ро░рпН
ЁЯзЛ	boba, bubble, food, milk, pearl, tea, роЙрогро╡рпБ, роХрпБрооро┐ро┤ро┐, роХрпБрооро┐ро┤ро┐родрпН, роЯрпА, родрпЗроирпАро░рпН, рокрокрпБро│рпН, рокропрогроорпН, рокро╛ро▓рпН, рокрпЛрокро╛, роорпБродрпНродрпБ
ЁЯзН	person, stand, standing, роирокро░рпН, роиро┐рооро┐ро░рпНроирпНродрпБ, роиро┐ро▒рпНрокродрпБ, роиро┐ро▒рпНро▒ро▓рпН, роиро┐ро▓рпН, роирпЗро░ро╛роХ
ЁЯзНтАНтЩАя╕П	stand, standing, woman, роиро┐ро▒рпНроХрпБроорпН, роиро┐ро▒рпНрокродрпБ, рокрпЖрогрпН
ЁЯзНтАНтЩВя╕П	man, stand, standing, роЖрогрпН, роиро┐ро▒рпНроХрпБроорпН, роиро┐ро▒рпНрокродрпБ
ЁЯзО	knee, kneel, kneeling, knees, person, роЖроЪройроорпН, родрпКро┤рпБроХрпИ, роирокро░рпН, роорогрпНроЯро┐ропро┐роЯро▓рпН, роорогрпНроЯро┐ропро┐роЯрпБродро▓рпН, роорпБро┤роЩрпНроХро╛ро▓ро┐роЯрпБродро▓рпН, ро╡роЬрпНро░ро╛роЪройроорпН
ЁЯзОтАНтЩАя╕П	knee, kneel, kneeling, knees, woman, рокрпЖрогрпН, роорогрпНроЯро┐ропро┐роЯрпНроЯрпБро│рпНро│, роорпБро┤роЩрпНроХро╛ро▓ро┐роЯрпБродро▓рпН
ЁЯзОтАНтЩАя╕ПтАНтЮбя╕П	facing, knee, kneel, kneeling, knees, right, woman
ЁЯзОтАНтЩВя╕П	knee, kneel, kneeling, knees, man, роЖрогрпН, роорогрпНроЯро┐ропро┐роЯрпНроЯрпБро│рпНро│, роорпБро┤роЩрпНроХро╛ро▓ро┐роЯрпБродро▓рпН
ЁЯзОтАНтЩВя╕ПтАНтЮбя╕П	facing, knee, kneel, kneeling, knees, man, right
ЁЯзОтАНтЮбя╕П	facing, knee, kneel, kneeling, knees, person, right
ЁЯзСтАНтЪХя╕П	doctor, health, healthcare, nurse, therapist, worker, роЕро│ро┐рокрпНрокро╡ро░рпН, роЪро┐роХро┐роЪрпНроЪрпИ, роЪрпБроХро╛родро╛ро░, роЪрпЖро╡ро┐ро▓ро┐ропро░рпН, роЪрпЗро╡рпИ, рокрогро┐ропро╛ро│ро░рпН, рооро░рпБродрпНродрпБро╡, рооро░рпБродрпНродрпБро╡ро░рпН
ЁЯзСтАНтЪЦя╕П	judge, justice, law, scale, scales, роирпАродро┐рокродро┐, роородро┐рокрпНрокрпАроЯрпБроХро│рпН
ЁЯзСтАНтЬИя╕П	pilot, plane, роУроЯрпНроЯро┐, ро╡ро┐рооро╛рой, ро╡ро┐рооро╛ройроорпН
ЁЯзСтАНЁЯМ╛	farmer, gardener, rancher, роЪрпЖропрпНрокро╡ро░рпН, родрпЛроЯрпНроЯроХрпНроХро╛ро░ро░рпН, рокрогро┐, рокрогрпНрогрпИропро┐ро▓рпН, ро╡ро┐ро╡роЪро╛ропро┐
ЁЯзСтАНЁЯН│	chef, cook, роЪроорпИропро▓рпНроХро╛ро░ро░рпН, роЪрпЖроГрокрпН
ЁЯзСтАНЁЯН╝	baby, feed, feeding, nanny, newborn, nursing, parent, person, роЕрокрпНрокро╛, роЕроорпНрооро╛, роХрпБро┤роирпНродрпИ, роХрпБро┤роирпНродрпИроХрпНроХрпБ, родроирпНродрпИ, родро╛ропрпН, роирокро░рпН, рокро╛ро▓рпВроЯрпНроЯрпБродро▓рпН, рокро╛ро▓рпВроЯрпНроЯрпБроорпН
ЁЯзСтАНЁЯОУ	graduate, student, рокроЯрпНроЯродро╛ро░ро┐, рооро╛рогро╡ро░рпН
ЁЯзСтАНЁЯОд	actor, entertainer, rock, rockstar, singer, star, роХрпЗро│ро┐роХрпНроХрпИропро╛ро│ро░рпН, роироЯро┐роХро░рпН, роироЯрпНроЪродрпНродро┐ро░роорпН, рокро╛роЯроХро░рпН
ЁЯзСтАНЁЯОи	artist, palette, роХро▓рпИроЮро░рпН, ро╡рогрпНрогродрпНродроЯрпНроЯрпБ
ЁЯзСтАНЁЯПл	instructor, lecturer, professor, teacher, роЖроЪро┐ро░ро┐ропро░рпН, рокропро┐ро▒рпНро▒рпБро╡ро┐рокрпНрокро╛ро│ро░рпН, рокрпЗро░ро╛роЪро┐ро░ро┐ропро░рпН
ЁЯзСтАНЁЯПн	assembly, factory, industrial, worker, роЪрокрпИ, родрпКро┤ро┐ро▒рпНроЪро╛ро▓рпИ, родрпКро┤ро┐ро▓ро╛ро│ро┐, родрпКро┤ро┐ро▓рпНродрпБро▒рпИ
ЁЯзСтАНЁЯТ╗	coder, computer, developer, inventor, software, technologist, роХрогрпНроЯрпБрокро┐роЯро┐рокрпНрокро╛ро│ро░рпН, роХрпБро▒ро┐рокрпНрокро╛ройрпН, роЯрпЖро╡рпЖро▓рокро░рпН, родрпКро┤ро┐ро▓рпН, роирпБроЯрпНрок, роорпЖройрпНрокрпКро░рпБро│рпН, ро╡ро▓рпНро▓рпБроиро░рпН
ЁЯзСтАНЁЯТ╝	architect, busines, business, collar, manager, office, white, worker, роЕро▓рпБро╡ро▓роХрокрпН, роХроЯрпНроЯро┐роЯроХрпНроХро▓рпИ, роХро╛ро▓ро░рпН, рокрогро┐ропро╛ро│ро░рпН, роорпЗро▓ро╛ро│ро░рпН, ро╡рогро┐роХ, ро╡рпИроЯрпН
ЁЯзСтАНЁЯФз	electrician, mechanic, plumber, tradesperson, роОро▓роХрпНроЯрпНро░рпАро╖ро┐ропройрпН, рокро┐ро│роорпНрокро░рпН, роорпЖроХрпНроХро╛ройро┐роХрпН
ЁЯзСтАНЁЯФм	biologist, chemist, engineer, mathematician, physicist, scientist, роЗропро▒рпНрокро┐ропро▓ро╛ро│ро░рпН, роЙропро┐ро░ро┐ропро▓ро╛ро│ро░рпН, рокрпКро▒ро┐ропро╛ро│ро░рпН, ро╡ро┐роЮрпНроЮро╛ройро┐, ро╡рпЗродро┐ропро┐ропро▓ро╛ро│ро░рпН
ЁЯзСтАНЁЯжп	accessibility, blind, cane, person, probing, white, роХрогрпН, роХрпЛро│ро╛ро▒рпБ, родроЯро┐ропрпБроЯройрпН, родрпЖро░ро┐ропро╛родро╡ро░рпН, роироЯроХрпНроХрпБроорпН, роирокро░рпН, рокро╛ро░рпНро╡рпИ
ЁЯзСтАНЁЯжптАНтЮбя╕П	accessibility, blind, cane, facing, person, probing, right, white
ЁЯзСтАНЁЯж╝	accessibility, in, motorized, person, wheelchair, роЕрогрпБроХро▓рпНродройрпНроорпИ, роЗро░рпБроХрпНроХрпБроорпН, роЪроХрпНроХро░, роирокро░рпН, роиро╛ро▒рпНроХро╛ро▓ро┐, роиро╛ро▒рпНроХро╛ро▓ро┐ропро┐ро▓рпН, роорпЛроЯрпНроЯро╛ро░рпН
ЁЯзСтАНЁЯж╝тАНтЮбя╕П	accessibility, facing, in, motorized, person, right, wheelchair
ЁЯзСтАНЁЯж╜	accessibility, in, manual, person, wheelchair, роЕрогрпБроХро▓рпНродройрпНроорпИ, роЗро░рпБроХрпНроХрпБроорпН, роЙроирпНродрокрпНрокроЯрпБроорпН, роХрпИропро╛ро▓рпН, роЪроХрпНроХро░, роирокро░рпН, роиро╛ро▒рпНроХро╛ро▓ро┐, роиро╛ро▒рпНроХро╛ро▓ро┐ропро┐ро▓рпН
ЁЯзСтАНЁЯж╜тАНтЮбя╕П	accessibility, facing, in, manual, person, right, wheelchair
ЁЯзСтАНЁЯй░	ballet, dancer, роХро▓рпИроЮро░рпН, роЯро╛ройрпНроЪро░рпН, роЯро╛ройрпНро╕ро░рпН, роироЯройроХрпН, рокро╛ро▓роЯрпН
ЁЯзСтАНЁЯЪА	astronaut, rocket, space, ро░ро╛роХрпНроХрпЖроЯрпН, ро╡ро┐рогрпНро╡рпЖро│ро┐, ро╡рпАро░ро░рпН
ЁЯзСтАНЁЯЪТ	fire, firefighter, firetruck, родрпАропрогрпИрокрпНрокрпБ, ро╡рогрпНроЯро┐, ро╡рпАро░ро░рпН
ЁЯзХ	bandana, head, headscarf, hijab, kerchief, mantilla, tichel, woman, роЕрогро┐роирпНрод, роЯро┐роЪрпЖро▓рпН, родро▓рпИ, родро▓рпИропро┐ро▓рпН, рокрпЖрогрпН, рооро╛рогрпНроЯро┐ро▓ро╛, ро╕рпНроХро╛ро░рпНроГрокрпН, ро╣ро┐роЬро╛рокрпН
ЁЯзЦ	day, in, luxuriou, luxurious, pamper, person, relax, room, sauna, spa, steam, steambath, steamy, unwind, роЕро▒рпИ, роХрпБро│ро┐роХрпНроХрпБроорпН, роХрпБро│ро┐ропро▓рпН, роЪро╡ро╛ройро╛, роирокро░рпН, роирпАро░ро╛ро╡ро┐, роирпАро░ро╛ро╡ро┐роХрпН, ро╕рпНрокро╛
ЁЯзЦтАНтЩАя╕П	day, in, luxuriou, luxurious, pamper, relax, room, sauna, spa, steam, steambath, steamy, unwind, woman, роЕро▒рпИ, роОроЯрпБроХрпНроХрпБроорпН, роХрпБро│ро┐ропро▓рпН, роЪро╡ро╛ройро╛, роирпАро░ро╛ро╡ро┐, роирпАро░ро╛ро╡ро┐роХрпН, рокрпЖрогрпН
ЁЯзЦтАНтЩВя╕П	day, in, luxuriou, luxurious, man, pamper, relax, room, sauna, spa, steam, steambath, steamy, unwind, роЕро▒рпИ, роЖрогрпН, роОроЯрпБроХрпНроХрпБроорпН, роХрпБро│ро┐ропро▓рпН, роЪро╡ро╛ройро╛, роирпАро░ро╛ро╡ро┐, роирпАро░ро╛ро╡ро┐роХрпН
ЁЯзЧ	climb, climber, climbing, mountain, person, rock, scale, up, роПро▒рпБроорпН, роирокро░рпН, рокрпЖрогрпН, рооро▓рпИ, рооро▓рпИропрпЗро▒рпБрокро╡ро░рпН, рооро▓рпИропрпЗро▒рпНро▒роорпН
ЁЯзЧтАНтЩАя╕П	climb, climber, climbing, mountain, rock, scale, up, woman, рокрпЖрогрпН, рооро▓рпИ, рооро▓рпИропрпЗро▒рпБрокро╡ро░рпН, рооро▓рпИропрпЗро▒рпБроорпН, рооро▓рпИропрпЗро▒рпНро▒роорпН
ЁЯзЧтАНтЩВя╕П	climb, climber, climbing, man, mountain, rock, scale, up, роЖрогрпН, рооро▓рпИ, рооро▓рпИропрпЗро▒рпБрокро╡ро░рпН, рооро▓рпИропрпЗро▒рпБроорпН, рооро▓рпИропрпЗро▒рпНро▒роорпН
ЁЯзШ	cros, cross, in, leg, legged, legs, lotu, lotus, meditation, peace, person, position, relax, serenity, yoga, yogi, zen, роЕроорпИродро┐, роЖроЪройроорпН, роЪроорпНроорогроорпН, роЬрпЖройрпН, родро┐ропро╛ройроорпН, роирокро░рпН, рокродрпНрооро╛роЪройроорпН, рокрпЖрогрпН, ропрпЛроХро╛
ЁЯзШтАНтЩАя╕П	cros, cross, in, leg, legged, legs, lotu, lotus, meditation, peace, position, relax, serenity, woman, yoga, yogi, zen, роЖроЪройроорпН, роЪрпЖропрпНропрпБроорпН, родро┐ропро╛ройроорпН, рокродрпНрооро╛роЪройроорпН, рокрпЖрогрпН, ропрпЛроХро╛
ЁЯзШтАНтЩВя╕П	cros, cross, in, leg, legged, legs, lotu, lotus, man, meditation, peace, position, relax, serenity, yoga, yogi, zen, роЖроЪройроорпН, роЖрогрпН, роЪрпЖропрпНропрпБроорпН, родро┐ропро╛ройроорпН, рокродрпНрооро╛роЪройроорпН, ропрпЛроХро╛
ЁЯзв	baseball, bent, billed, cap, dad, hat, роХрпЛроЯрпИ, роЪро┐ройрпНройроорпБро│рпНро│, родрпКрокрпНрокро┐, рокрпЗро╕рпНрокро╛ро▓рпН, рокрпКро░рпБро│рпН, ро╡рпЖропро┐ро▓рпН
ЁЯзг	bundle, cold, neck, scarf, up, роЕрогро┐, роХро┤рпБродрпНродрпБ, роХрпБро│ро┐ро░рпН, рокрпКро░рпБро│рпН, ро╕рпНроХро╛ро░рпНроГрокрпН, ро╕рпНроЯрпИро▓рпН
ЁЯзд	glove, gloves, hand, роХро┐ро│ро╡рпБро╕рпН, роХрпИ, роХрпИропрпБро▒рпИ, роХрпИропрпБро▒рпИроХро│рпН, рокро╛родрпБроХро╛рокрпНрокрпБ, рокрпКро░рпБро│рпН
ЁЯзе	brr, bundle, coat, cold, jacket, up, роЖроЯрпИ, роХроорпНрокро│ро┐, роХрпБро│ро┐ро░рпН, роХрпЛроЯрпН, роЪро┐ро╡рокрпНрокрпБ, роЪрпВроЯрпН, роЬро╛роХрпНроХрпЖроЯрпН, рокрпКро░рпБро│рпН
ЁЯзж	sock, socks, stocking, роХро╛ро▓рпБро▒рпИ, роХрпБро│ро┐ро░рпН, роЪро╛роХрпНро╕рпН, рокрпКро░рпБро│рпН, ро╕рпНроЯро╛роХрпНроХро┐роЩрпНро╕рпН, ро╕рпНроЯрпИро▓рпН
ЁЯзз	envelope, gift, good, h├│ngb─Бo, lai, luck, money, red, see, роЙро▒рпИ, роХро╡ро░рпН, роЪройрпНрооро╛ройроорпН, роЪро┐ро╡рокрпНрокрпБ, рокрогроорпН, рокро░ро┐роЪрпБ, роорпКропрпН, ро╡ро╛ро┤рпНродрпНродрпБ
ЁЯзи	dynamite, explosive, fire, firecracker, firework, fireworks, light, pop, popping, spark, роЯрпИройроорпИроЯрпН, рокро╛роорпН, ро╡ро╛ройро╡рпЗроЯро┐роХрпНроХрпИ, ро╡рпЖроЯро┐, ро╡рпЖроЯро┐рокрпНрокрпКро░рпБро│рпН, ро╡рпЖроЯро┐рооро░рпБроирпНродрпБ
ЁЯзй	clue, interlocking, jigsaw, piece, puzzle, роХрпНро│рпВ, роЪрпЗро░рпНродрпНродро▓рпН, роЬро┐роХрпНро╕ро╛, родрпБрогрпНроЯрпБ, родрпБрокрпНрокрпБ, рокрпБродро┐ро░рпН
ЁЯзк	chemist, chemistry, experiment, lab, science, test, tube, роЕро▒ро┐ро╡ро┐ропро▓рпН, роЖропрпНро╡рпБроХрпНроХрпВроЯроорпН, роХрпБро┤ро╛ропрпН, роЪрпЛродройрпИроХрпН, роЪрпЛродройрпИроХрпНроХрпБро┤ро╛ропрпН, рокро░ро┐роЪрпЛродройрпИ, рокрпКро░рпБро│рпН, ро╡рпЗродро┐ропро▓ро╛ро│ро░рпН, ро╡рпЗродро┐ропро┐ропро▓ро░рпН, ро╡рпЗродро┐ропро┐ропро▓рпН
ЁЯзл	bacteria, biologist, biology, culture, dish, lab, petri, роЖропрпНро╡роХроорпН, роЙропро┐ро░ро┐ропро▓ро╛ро│ро░рпН, роЙропро┐ро░ро┐ропро▓рпН, роХро▓ро╛роЪрпНроЪро╛ро░роорпН, роЯро┐ро╖рпН, рокро╛роХрпНроЯрпАро░ро┐ропро╛, рокрпЖроЯрпНро░ро┐, рокрпКро░рпБро│рпН
ЁЯзм	biologist, dna, evolution, gene, genetic, genetics, life, роЙропро┐ро░ро┐ропро▓ро╛ро│ро░рпН, роЬрпАройрпН, роЯро┐роОройрпНроП, рокро░ро┐рогро╛роороорпН, рокрпКро░рпБро│рпН, рооро░рокрогрпБ, рооро░рокро┐ропро▓рпН, ро╡ро╛ро┤рпНроХрпНроХрпИ
ЁЯзн	compas, compass, direction, magnetic, navigation, orienteering, роУро░ро┐ропройрпНроЯрпН, роХро╛роорпНрокро╕рпН, родро┐роЪрпИ, родро┐роЪрпИроХро╛роЯрпНроЯро┐, роирпЗро╡ро┐роХрпЗро╖ройрпН, роорпЗроХрпНройроЯрпНроЯро┐роХрпН, ро╡ро┤ро┐, ро╡ро┤ро┐роЪрпНроЪрпЖро▓рпБродрпНродро▓рпН
ЁЯзо	abacu, abacus, calculation, calculator, роЕрокро╛роХро╕рпН, роЕрокро╛роХрпНроХро╕рпН, роХрогроХрпНроХрпАроЯрпБ, роХрогроХрпНроХрпБ, роХрогро┐родроорпН, роХрогро┐рокрпНрокро╛ройрпН, рокрпКро░рпБро│рпН
ЁЯзп	extinguish, extinguisher, fire, quench, роЕрогрпИродрпНродро▓рпН, роЕрогрпИрокрпНрокро╛ройрпН, родрогро┐родрпНродро▓рпН, родрпА, родрпАропрогрпИрокрпНрокро╛ройрпН, рокрпКро░рпБро│рпН
ЁЯз░	box, chest, mechanic, red, tool, toolbox, роХро░рпБро╡ро┐рокрпНрокрпЖроЯрпНроЯро┐, роЯрпВро▓рпН, роЯрпВро▓рпНрокро╛роХрпНро╕рпН, рооро╛ро░рпНрокрпБ, роорпЖроХрпНроХро╛ройро┐роХрпН
ЁЯз▒	brick, bricks, clay, mortar, wall, роХро│ро┐роорогрпН, роХро╛ро░рпИ, роЪрпБро╡ро░рпН, роЪрпЖроЩрпНроХро▓рпН, роЪрпЖроЩрпНроХро▓рпНроХро│рпН
ЁЯз▓	attraction, horseshoe, magnet, magnetic, negative, positive, shape, роИро░рпНрокрпНрокрпБ, роХро╛роирпНродроорпН, роХрпБродро┐ро░рпИро▓ро╛роЯроорпН, ро▓ро╛роЯроорпН
ЁЯз│	bag, luggage, packing, roller, suitcase, travel, роЪрпВроЯрпНроХрпЗро╕рпН, роЯро┐ро░ро╛ро▓ро┐, рокропрогрокрпН, рокропрогроорпН, рокрпЗроХрпНроХро┐роЩрпН, рокрпКродро┐, ро▓роХрпНроХрпЗроЬрпН, ро╕рпНроЯрпНро░ро╛ро▓ро┐
ЁЯз┤	bottle, lotion, moisturizer, shampoo, sunscreen, роЪройрпНро╕рпНроХро┐ро░рпАройрпН, рокро╛роЯрпНроЯро┐ро▓рпН, рокрпКро░рпБро│рпН, рооро╛ропрпНро╕рпНроЪро░рпИроЪро░рпН, ро▓рпЛро╖ройрпН, ро╖ро╛роорпНрокрпБ
ЁЯз╡	needle, sewing, spool, string, thread, роЗро┤рпИ, роКроЪро┐, роХрогрпНроЯрпБ, роЪро░роорпН, родрпИропро▓рпН, роирпВро▓рпН, ро╕рпНрокрпВро▓рпН
ЁЯз╢	ball, crochet, knit, yarn, роХрпБро│ро┐ро░ро╛роЯрпИ, роХрпИро╡рпЗро▓рпИ, роХрпКроХрпНроХро┐рокрпНрокро┐ройрпНройро▓рпН, роХрпНро░рпЛро╖ро╛, роирпВро▓рпНроХрогрпНроЯрпБ, рокроирпНродрпБ, рокро┐ройрпНройро▓рпН
ЁЯз╖	diaper, pin, punk, rock, safety, роКроХрпНроХрпБ, роХро╛рокрпНрокрпВроЪро┐, роЪрпЗроГрокрпНроЯро┐, роЯропрокро░рпН, рокроЩрпНроХрпН, рокро┐ройрпН, ро░ро╛роХрпН
ЁЯз╕	bear, plaything, plush, stuffed, teddy, toy, роХро░роЯро┐, роЯро╛ропрпН, роЯрпЖроЯро┐, роЯрпЖроЯро┐рокро┐ропро░рпН, роЯрпЖроЯрпНроЯро┐, рокроЮрпНроЪрпБ, рокроЯрпНроЯрпБ, рокро┐ропро░рпН, рокрпКроорпНроорпИ, рокрпКроорпНроорпИроХрпН, ро╡ро┐ро│рпИропро╛роЯрпНроЯрпБрокрпНрокрпКро░рпБро│рпН, ро╕ро╛роГрокрпНроЯрпН
ЁЯз╣	broom, cleaning, sweeping, witch, роЪрпБродрпНродроорпН, роЪрпВройро┐ропроХрпНроХро╛ро░ро┐, родрпБроЯрпИрокрпНрокроорпН, родрпБрокрпНрокрпБро░ро╡рпБ
ЁЯз║	basket, farming, laundry, picnic, роХрпВроЯрпИ, роЪро▓ро╡рпИ, роЪрпБро▒рпНро▒рпБро▓ро╛, родрпЗроирпАро░рпН, родрпЛроЯрпНроЯроорпН, рокро┤роорпН, ро╡ро┐ро╡роЪро╛ропроорпН
ЁЯз╗	of, paper, roll, toilet, towel, towels, роХро╛роХро┐род, роЪрпБро░рпБро│рпН, роЯро╡ро▓рпН, роЯро╛ропрпНро▓рпЖроЯрпН, родрпБроЯрпИрокрпНрокро╛ройрпН, рокрпЗрокрпНрокро░рпН, рокрпКро░рпБро│рпН, ро░рпЛро▓рпН
ЁЯз╝	bar, bathing, clean, cleaning, lather, soap, soapdish, роХрпБро│ро┐ропро▓рпН, роЪрпБродрпНродроорпН, роЪрпЛрокрпН, роЪрпЛрокрпНрокрпБ, роЯрокрпНрокро╛, роирпБро░рпИ, рокрпКро░рпБро│рпН
ЁЯз╜	absorbing, cleaning, porou, porous, soak, sponge, роЙро▒ро┐роЮрпНроЪро┐, роЙро▒ро┐роЮрпНроЪрпБродро▓рпН, роЪрпБродрпНродроорпН, родрпБро│рпИроХро│рпН, рокрпКро░рпБро│рпН, ро╕рпНрокро╛роЮрпНроЪрпБ, ро╕рпНрокро╛ройрпНроЪрпН, ро╕рпНрокро╛ройрпНроЮрпН
ЁЯз╛	accounting, bookkeeping, evidence, invoice, proof, receipt, роЖродро╛ро░роорпН, роЗройрпНро╡ро╛ропрпНро╕рпН, роХрогроХрпНроХрпБро╡ро┤роХрпНроХрпБ, роЪро╛роЯрпНроЪро┐ропроорпН, роЪрпЖро▓ро╡рпБ, рокроЯрпНроЯро┐ропро▓рпН, рокрпКро░рпБро│рпН, ро░роЪрпАродрпБ, ро╡ро░ро╡рпБ, ро╡ро┐ро▓рпИ, ро╡ро┐ро▓рпИрокрпНрокроЯрпНроЯро┐ропро▓рпН
ЁЯз┐	amulet, bead, blue, charm, evil, eye, nazar, talisman, роЕро┤роХрпБ, роЖроорпБро▓роЯрпН, роХрогрпН, родропро╛родрпНродрпБ, родро╛ропродрпНродрпБ, родрпАроп, роиро╛роЪро░рпН, роиро╛роЬро░рпН, роирпАро▓роорпН, роорогро┐
ЁЯй░	ballet, dance, shoe, shoes, роХро╛ро▓рогро┐, роХро╛ро▓рогро┐роХро│рпН, роироЯройроорпН, рокро╛ро▓рпЗ
ЁЯй▒	bathing, one, piece, suit, swimsuit, роЖроЯрпИ, роХрпБро│ро┐ропро▓рпН, роЪрпВроЯрпН, роирпАроЪрпНроЪро▓рпН, ро╕рпНро╡ро┐роорпН
ЁЯй▓	bathing, brief, briefs, one, piece, suit, swimsuit, underwear, роЕрогрпНроЯро░рпНро╡рпЗро░рпН, роЕройрпНроЯро░рпНро╡рпЗро░рпН, роЖроЯрпИ, роЙро│рпНро│ро╛роЯрпИ, роХрпБро▒рпБроЩрпНроХро╛ро▓рпНроЪроЯрпНроЯрпИ, роХрпБро│ро┐ропро▓рпН, роЬроЯрпНроЯро┐, роирпАроЪрпНроЪро▓рпН, рокрпНро░рпАроГрокрпН
ЁЯй│	bathing, pant, pants, short, shorts, suit, swimsuit, underwear, роЕрогрпНроЯро░рпНро╡рпЗро░рпН, роЕройрпНроЯро░рпНро╡рпЗро░рпН, роЖроЯрпИ, роЙро│рпНро│ро╛роЯрпИ, роХро╛ро▓рпНроЪроЯрпНроЯрпИ, роХрпБро│ро┐ропро▓рпН, роЯро┐ро░роЩрпНроХрпН
