emoji	keywords
ЁЯПо	bar, lantern, light, paper, red, restaurant, роТро│ро┐, роХро╛роХро┐род, роЪро┐роХрокрпНрокрпБ, роЪро┐ро╡рокрпНрокрпБ, роЬрокрпНрокро╛ройро┐роп, роиро┐ро▒, рокро╛ро░рпН, рокрпКро░рпБро│рпН, ро░рпЖро╕рпНроЯро╛ро░ройрпНроЯрпН, ро╡ро┐ро│роХрпНроХрпБ
ЁЯПп	building, castle, japanese, роЕро░рогрпНрооройрпИ, роХроЯрпНроЯро┐роЯроорпН, роХрпЗро╕ро┐ро▓рпН, роХрпЛроЯрпНроЯрпИ, роЬрокрпНрокро╛ройрпН, рокро╛рогро┐
ЁЯП░	building, castle, european, роЕро░рогрпНрооройрпИ, роРро░рпЛрокрпНрокро┐роп, роХроЯрпНроЯро┐роЯроорпН, роХрпЗро╕ро┐ро▓рпН, роХрпЛроЯрпНроЯрпИ, рокро╛рогро┐
ЁЯП╕	badminton, birdie, game, racquet, shuttlecock, роХрпЗроорпН, рокрпВрокрпНрокроирпНродро╛роЯрпНроЯроорпН, рокрпВрокрпНрокроирпНродрпБ, рокрпЗроЯрпНрооро┐рогрпНроЯройрпН, ро╡ро┐ро│рпИропро╛роЯрпНроЯрпБ, ро╖роЯрпНроЯро┐ро▓рпНроХро╛роХрпН
ЁЯП╣	archer, archery, arrow, bow, sagittariu, sagittarius, tool, weapon, zodiac, роЕроорпНрокрпБ, роЕроорпНрокрпБроорпН, роЖропрпБродроорпН, родройрпБроЪрпБ, ропрпБродрпНродроорпН, ро░ро╛роЪро┐, ро░ро╛рооройрпН, ро░ро╛рооро░рпН, ро╡ро┐ро▓рпН, ро╡ро┐ро▓рпНро▓рпБроорпН, ро╡ро┐ро▓рпНро╡ро┐родрпНродрпИ
ЁЯП║	amphora, aquariu, aquarius, cooking, drink, jug, tool, weapon, zodiac, роЕро▓роЩрпНроХро╛ро░, роЙрогро╡рпБ, роХрпБроорпНрок, роХрпБроорпНрокроорпН, роЬро╛роЯро┐, рокро╛ройроорпН, рокрпКро░рпБро│рпН, ро░ро╛роЪро┐, ро╡рпАроЯрпНроЯрпБ
ЁЯРА	animal, rat, роОро▓ро┐, роЬрпЖро░рпНро░ро┐, ро╡ро┐ро▓роЩрпНроХрпБ
ЁЯРБ	animal, animals, mouse, роОро▓ро┐, роЪрпБрогрпНроЯрпЖро▓ро┐, ро╡ро┐ро▓роЩрпНроХрпБ
ЁЯРВ	animal, animals, bull, farm, ox, tauru, taurus, zodiac, роОро░рпБродрпБ, роХро╛ро│рпИ, ро░ро╛роЪро┐, ро╡ро┐ро▓роЩрпНроХрпБ
ЁЯРГ	animal, buffalo, water, zoo, роОро░рпБроорпИ, роирпАро░рпН, рооро┐ро░рпБроХроорпН, ро╡ро┐ро▓роЩрпНроХрпБ
ЁЯРД	animal, animals, cow, farm, milk, moo, рокроЪрпБ, рокроЪрпБрооро╛роЯрпБ, рокрогрпНрогрпИ, рокро╛ро▓рпН, ро╡ро┐ро▓роЩрпНроХрпБ
ЁЯРЕ	animal, big, cat, predator, tiger, zoo, роЪро░рогро╛ро▓ропроорпН, родрпЗроЪро┐роп, рокрпБро▓ро┐, рооро┐ро░рпБроХроорпН, ро╡ройро╡ро┐ро▓роЩрпНроХрпБ, ро╡ро┐ро▓роЩрпНроХрпБ
ЁЯРЖ	animal, big, cat, leopard, predator, zoo, роХро╛роЯрпБ, роЪро░рогро╛ро▓ропроорпН, роЪро┐ро▒рпБродрпНродрпИ, роЪро┐ро▒рпБродрпНродрпИрокрпНрокрпБро▓ро┐, рооро┐ро░рпБроХроорпН, ро╡ройро╡ро┐ро▓роЩрпНроХрпБ, ро╡ро┐ро▓роЩрпНроХрпБ
ЁЯРЗ	animal, bunny, pet, rabbit, роХрпБроЯрпНроЯро┐, роЪрпЖро▓рпНро▓рокрпНрокро┐ро░ро╛рогро┐, роорпБропро▓рпН, роорпКроЪроХрпН, ро░рпЗрокро┐роЯрпН, ро╡ро┐ро▓роЩрпНроХрпБ
ЁЯРИя╕П	animal, animals, cat, cats, kitten, pet, роЪрпЖро▓рпНро▓рокрпНрокро┐ро░ро╛рогро┐, рокрпВройрпИ, рокрпВройрпИроХрпНроХрпБроЯрпНроЯро┐, ро╡ро┐ро▓роЩрпНроХрпБ
ЁЯРИтАНтмЫ	animal, black, cat, feline, halloween, meow, unlucky, роХро░рпБрокрпНрокрпБ, роХро░рпБрокрпНрокрпБрокрпН, родрпБро░родро┐ро░рпНро╖рпНроЯроорпН, рокрпВройрпИ, ро╡ро┐ро▓роЩрпНроХрпБ
ЁЯРЙ	animal, dragon, fairy, fairytale, knight, knights, tale, роЖроГрокрпН, роХрпЗроорпН, роЪрпАрой, роЪрпАройро╛, роЯро┐ро░ро╛роХройрпН, родрпНро░рпЛройрпНро╕рпН, роиро╛роХроорпН, рокро▒роХрпНроХрпБроорпН, рооро┐ро░рпБроХроорпН, ро╡ро┐ро▓роЩрпНроХрпБ
ЁЯРК	animal, crocodile, zoo, роКро░рпНро╡родрпБ, роЪро░рогро╛ро▓ропроорпН, роорпБродро▓рпИ, ро╡ройро╡ро┐ро▓роЩрпНроХрпБ, ро╡ро┐ро▓роЩрпНроХрпБ
ЁЯРЛ	animal, beach, ocean, whale, роЙропро┐ро░ро┐, роЪрпБро▒ро╛, родро┐рооро┐роЩрпНроХро▓роорпН, роирпАро░рпНро╡ро╛ро┤рпН, рокро╛ро▓рпВроЯрпНроЯро┐, ро╡ро┐ро▓роЩрпНроХрпБ
ЁЯРМ	animal, escargot, garden, nature, slug, snail, роиродрпНродрпИ, ро╡ро┐ро▓роЩрпНроХрпБ
ЁЯРН	animal, bearer, ophiuchu, ophiuchus, serpent, snake, zodiac, роиро╛роХроорпН, рокро╛роорпНрокрпБ, ро╡ро┐ро▓роЩрпНроХрпБ
ЁЯРО	animal, equestrian, farm, horse, racehorse, racing, роУроЯрпБроорпН, роХрпБродро┐ро░рпИ, рокроирпНродроп, рокроирпНродропроорпН, ро░рпЗро╕рпНроХрпЛро░рпНро╕рпН, ро╡ро┐ро▓роЩрпНроХрпБ
ЁЯРП	animal, aries, ary, horn, horns, male, ram, sheep, zodiac, zoo, роЖроЯрпБ, роЖроЯрпНроЯрпБроХрпНроХроЯро╛, роЗро░ро╛роЪро┐, роХро┐роЯро╛, роХрпКроорпНрокрпБ, роЪрпЖроорпНрооро▒ро┐, роорпЗро╖роорпН, ро░ро╛роЪро┐, ро╡ро┐ро▓роЩрпНроХрпБ
ЁЯРР	animal, capricorn, farm, goat, milk, zodiac, роЖроЯрпБ, роЗро░ро╛роЪро┐, роороХро░роорпН, ро░ро╛роЪро┐, ро╡ро┐ро▓роЩрпНроХрпБ, ро╡рпЖро│рпНро│ро╛роЯрпБ
ЁЯРС	animal, baa, ewe, farm, female, fluffy, lamb, sheep, wool, роЖроЯрпБ, роХроорпНрокро│ро┐, роЪрпЖроорпНрооро▒ро┐, рокрогрпНрогрпИ, ро╡ро┐ро▓роЩрпНроХрпБ
ЁЯРТ	animal, banana, monkey, роХрпБро░роЩрпНроХрпБ, роХрпЛродро┐, роороЩрпНроХро┐, ро╡ро╛ройро░роорпН, ро╡ро┐ро▓роЩрпНроХрпБ
ЁЯРУ	animal, bird, ornithology, rooster, роХрпВро╡рпБродро▓рпН, роХрпКроХрпНроХро░роХрпНроХрпЛ, роЪрпЗро╡ро▓рпН, рокро▒ро╡рпИ, ро╡рпАроЯрпНроЯрпБроЪрпН
ЁЯРФ	animal, bird, chicken, ornithology, роХрпБроЮрпНроЪрпБ, роХрпЛро┤ро┐роХрпНроХрпБроЮрпНроЪрпБ, роЪро┐роХрпНроХройрпН, рокро▒ро╡рпИ
ЁЯРХя╕П	animal, animals, dog, dogs, pet, роЪрпЖро▓рпНро▓рокрпНрокро┐ро░ро╛рогро┐, роиро╛ропрпН, роиро╛ропрпНроХрпНроХрпБроЯрпНроЯро┐, ро╡ро┐ро▓роЩрпНроХрпБ
ЁЯРХтАНЁЯж║	accessibility, animal, assistance, dog, service, роЙродро╡ро┐, роЪрпЖро▓рпНро▓рпБродро▓рпН, роЪрпЗро╡рпИ, роЪрпЗро╡рпИрокрпБро░ро┐ропрпБроорпН, роиро╛ропрпН, ро╡ро┐ро▓роЩрпНроХрпБ
ЁЯРЦ	animal, bacon, farm, pig, pork, sow, рокрогрпНрогрпИ, рокройрпНройро┐, рокройрпНро▒ро┐, рокройрпНро▒ро┐роХрпНроХрпБроЯрпНроЯро┐, рокрпЛро░рпНроХрпН, ро╡ро┐ро▓роЩрпНроХрпБ, ро╡рпЖро│рпНро│рпИ
ЁЯРЧ	animal, boar, pig, роЕро╡родро╛ро░роорпН, роЖрогрпНрокройрпНро▒ро┐, рокройрпНройро┐, рокройрпНро▒ро┐, ро╡ро░ро╛роХ, ро╡ро░ро╛роХроорпН, ро╡ро┐ро▓роЩрпНроХрпБ
ЁЯРШ	animal, elephant, роХрпБроЯрпНроЯро┐, роЪро░рогро╛ро▓ропроорпН, ропро╛ройрпИ, ропро╛ройрпИроХрпБроЯрпНроЯро┐, ро╡ро┐ро▓роЩрпНроХрпБ
ЁЯРЩ	animal, creature, ocean, octopu, octopus, роЖроХрпНроЯрпЛрокро╕рпН, роХроЯро▓рпН, рокрпЗропрпНроХрпНроХрогро╡ро╛ропрпН, ро╡ро┐ро▓роЩрпНроХрпБ
ЁЯРЪ	animal, beach, conch, sea, shell, spiral, роХроЯро▒рпНроХро░рпИ, роХроЯро▓рпН, роХро┐ро│ро┐роЮрпНроЪро▓рпН, роЪроЩрпНроХрпБ, роЪро┐рокрпНрокро┐, роорпБродрпНродрпБ, ро╡ро┐ро▓роЩрпНроХрпБ
ЁЯРЫ	animal, bug, garden, insect, роХроорпНрокро│ро┐рокрпНрокрпБро┤рпБ, рокрпБро┤рпБ, рокрпВроЪрпНроЪро┐, рокрпВро░ро╛ройрпН, роорпВроЯрпНроЯрпИрокрпН, ро╡ро┐ро▓роЩрпНроХрпБ
ЁЯРЬ	animal, ant, garden, insect, роЗройро┐рокрпНрокрпБ, роОро▒рпБроорпНрокрпБ, роХроЯро┐, рокрпВроЪрпНроЪро┐, ро╡ро┐ро▓роЩрпНроХро┐ройроорпН
ЁЯРЭ	animal, bee, bumblebee, honey, honeybee, insect, nature, spring, роХрпВроЯрпБ, родрпЗройрпА, родрпЗройрпН, рокрпВроЪрпНроЪро┐, ро░рпАроЩрпНроХро╛ро░роорпН, ро╡ро┐ро▓роЩрпНроХро┐ройроорпН
ЁЯРЮ	animal, beetle, garden, insect, lady, ladybird, ladybug, nature, роХрпБро│ро╡ро┐, рокроХрпН, рокрпВроЪрпНроЪро┐, рокрпЖрогрпН, ро▓рпЗроЯро┐, ро╡рогрпНроЯрпБ, ро╡ро┐ро▓роЩрпНроХро┐ройроорпН
ЁЯРЯя╕П	animal, dinner, fish, fishe, fishes, fishing, pisce, pisces, zodiac, роЙропро┐ро░ро┐ройроорпН, роирпАро░рпНро╡ро╛ро┤рпН, роорпАройроорпН, роорпАройрпН, ро╡ро┐ро▓роЩрпНроХро┐ройроорпН
ЁЯРа	animal, fish, fishe, fishes, tropical, роЙропро┐ро░ро┐ройроорпН, роиройрпНройрпАро░рпН, роирпАро░рпНро╡ро╛ро┤рпН, роорпАройрпН, ро╡ро┐ро▓роЩрпНроХро┐ройроорпН, ро╡рпЖрокрпНрокроорогрпНроЯро▓
ЁЯРб	animal, blowfish, fish, роГрокро┐ро╖рпН, роЙропро┐ро░ро┐ройроорпН, роКродро┐рокрпНрокрпЖро░рпБроХрпНроХроороЯрпИропрпБроорпН, роХрпБро│рпЛрокрпН, роирпАро░рпНро╡ро╛ро┤рпН, рокрпНро│рпЛ, роорпАройрпН, ро╡ро┐ро▓роЩрпНроХро┐ройроорпН
ЁЯРв	animal, terrapin, tortoise, turtle, роЖроорпИ, роКро░рпНро╡рой, роХроЯро▓ро╛роорпИ, ро╡ро┐ро▓роЩрпНроХро┐ройроорпН
ЁЯРг	animal, baby, bird, chick, egg, hatching, роХрпБроЮрпНроЪрпБ, роХрпЛро┤ро┐роХрпНроХрпБроЮрпНроЪрпБ, рокро▒ро╡рпИ, рокрпКро▒ро┐родрпНродро▓рпН, роорпБроЯрпНроЯрпИропро┐ро▓ро┐ро░рпБроирпНродрпБ, ро╡рпЖро│ро┐ро╡ро░рпБроорпН
ЁЯРд	animal, baby, bird, chick, ornithology, роХрпБроЮрпНроЪрпБ, роХрпЛро┤ро┐, роХрпЛро┤ро┐роХрпНроХрпБроЮрпНроЪрпБ, роЪро┐роХрпНроХройрпН, ро╡ро┐ро▓роЩрпНроХро┐ройроорпН
ЁЯРе	animal, baby, bird, chick, facing, front, newborn, ornithology, роХрпБроЮрпНроЪрпБ, роХрпЛро┤ро┐, роХрпЛро┤ро┐роХрпНроХрпБроЮрпНроЪрпБ, роЪро┐роХрпНроХройрпН, роирпЗро░рпБроХрпНроХрпБ, роирпЗро░рпН, рокро▒ро╡рпИ, рокро╛ро░рпНроХрпНроХрпБроорпН, роорпБройрпНроиро┐ройрпНро▒рпБ, ро╡ро┐ро▓роЩрпНроХро┐ройроорпН
ЁЯРжя╕П	animal, bird, ornithology, рокро▒ро╡рпИ, роорпВроХрпНроХрпБ, ро╡ро┐ро▓роЩрпНроХро┐ройроорпН
ЁЯРжтАНтмЫ	animal, beak, bird, black, caw, corvid, crow, ornithology, raven, rook, роЕрогрпНроЯроЩрпНроХро╛роХрпНроХрпИ, роХро░рпБрокрпНрокрпБ, роХро╛роХроорпН, роХро╛роХро╛, роХро╛роХрпНроХрпИро╡роХрпИ, роХрпЛро╡ро┐роЯрпН, рокро▒ро╡рпИ, роорпИройро╛
ЁЯРжтАНЁЯФе	ascend, ascension, emerge, fantasy, firebird, glory, immortal, phoenix, rebirth, reincarnation, reinvent, renewal, revival, revive, rise, transform, роГрокрпАройро┐роХрпНро╕рпН, роГрокрпЗрогрпНроЯро╕ро┐, роЗро▒ро╡ро╛родрпБ, роЙропро┐ро░рпНрокрпНрокро┐родрпНродро▓рпН, роХро▒рпНрокройрпИ, роЪро╛роХро╛ро╡ро░роорпН, родрпАрокрпНрокро▒ро╡рпИ, рооро▒рпБрокро┐ро▒рокрпНрокрпБ, рооро▒рпБрокро┐ро▒ро╡ро┐, рооро╛ро▒рпНро▒роорпН
ЁЯРз	animal, antarctica, bird, ornithology, penguin, роЕрогрпНроЯро╛ро░рпНроЯро┐роХро╛, рокро▒ро╡рпИ, рокрпЖроЩрпНроХрпБропро┐ройрпН, рокрпЖройрпНроХрпБропро┐ройрпН
ЁЯРи	animal, australia, bear, down, koala, marsupial, under, роХрпЛро▓ро╛, роХрпЛро╡ро╛ро▓ро╛, рокро╛ро▓рпВроЯрпНроЯро┐, рокро┐ропро░рпН, ро╡ро┐ро▓роЩрпНроХро┐ройроорпН, ро╡ро┐ро▓роЩрпНроХрпБ
ЁЯРй	animal, dog, fluffy, poodle, роЕроЯро░рпНродрпНродро┐ропро╛рой, роХрпКрогрпНроЯ, роЪрпЖро▓рпНро▓рокрпНрокро┐ро░ро╛рогро┐, роиро╛ропрпН, рокрпВроЯро┐ро▓рпН, роорпБроЯро┐, ро╡роХрпИ, ро╡ро┐ро▓роЩрпНроХро┐ройроорпН
ЁЯРк	animal, camel, desert, dromedary, hump, one, роТроЯрпНроЯроХроорпН, роТро░рпБ, роТро▒рпНро▒рпИродрпН, роХрпЗрооро▓рпН, роХрпКрогрпНроЯ, родро┐рооро┐ро▓рпН, рокро╛ро▓рпИро╡ройроорпН
ЁЯРл	animal, bactrian, camel, desert, hump, two, роЗро░роЯрпНроЯрпИродрпН, роЗро░рпБ, роТроЯрпНроЯроХроорпН, роХрпКрогрпНроЯ, родро┐рооро┐ро▓рпН, рокро╛роХрпНроЯро┐ро░ро┐ропройрпН, рокро╛ро▓рпИро╡ройроорпН
ЁЯРм	animal, beach, dolphin, flipper, ocean, роХроЯро▓рпН, роЯро╛ро▓рпНроГрокро┐ройрпН, роЯро╛ро▓рпНрокро┐ройрпН, рокро╛ро▓рпВроЯрпНроЯро┐, рокрпАроЪрпН, ро╡ро┐ро▓роЩрпНроХро┐ройроорпН
ЁЯРн	animal, mouse, роОро▓ро┐, роХрпБроЯрпНроЯро┐, роЪрпБрогрпНроЯрпЖро▓ро┐, роорпБроХроорпН, ро╡ро┐ро▓роЩрпНроХрпБ
ЁЯРо	animal, cow, farm, milk, moo, рокроЪрпБ, рокрогрпНрогрпИ, рокро╛ро▓рпН, рооро╛роЯрпБ, роорпБроХроорпН, ро╡ро┐ро▓роЩрпНроХрпБ
ЁЯРп	animal, big, cat, predator, tiger, роЯрпИроХро░рпН, родрпЗроЪро┐роп, рокрпБро▓ро┐, роорпБроХроорпН, ро╡ро┐ро▓роЩрпНроХро┐ройроорпН, ро╡ро┐ро▓роЩрпНроХрпБ
ЁЯР░	animal, bunny, pet, rabbit, роХрпБроЯрпНроЯро┐, роорпБроХроорпН, роорпБропро▓рпН, роорпКроЪроХрпН, ро╡ро┐ро▓роЩрпНроХрпБ
ЁЯР▒	animal, cat, kitten, kitty, pet, роХро┐роЯрпНроЯройрпН, роХро┐роЯрпНроЯро┐, роЪрпЖро▓рпНро▓рокрпНрокро┐ро░ро╛рогро┐, рокрпВройрпИ, рокрпВройрпИроХрпНроХрпБроЯрпНроЯро┐, роорпБроХроорпН, ро╡ро┐ро▓роЩрпНроХрпБ
ЁЯР▓	animal, dragon, fairy, fairytale, tale, роЯро┐ро░ро╛роХройрпН, роиро╛роХроорпН, рокро▒роХрпНроХрпБроорпН, рооро┐ро░рпБроХроорпН, роорпБроХроорпН, ро╡ро┐ро▓роЩрпНроХрпБ
ЁЯР│	animal, beach, ocean, spouting, whale, роЕроЯро┐роХрпНроХрпБроорпН, роХроЯро▓рпН, родрогрпНрогрпАро░рпИрокрпН, родро┐рооро┐роЩрпНроХро▓роорпН, рокрпАропрпНроЪрпНроЪро┐, ро╡ро┐ро▓роЩрпНроХро┐ройроорпН, ро╡ро┐ро▓роЩрпНроХрпБ
ЁЯР┤	animal, dressage, equine, farm, horse, horses, роХрпБродро┐ро░рпИ, роХрпКроЯрпНроЯро┐ро▓рпН, рокрогрпНрогрпИ, роорпБроХроорпН, ро╡ро┐ро▓роЩрпНроХрпБ
ЁЯР╡	animal, banana, monkey, роХрпБро░роЩрпНроХрпБ, роЪрпЗроЯрпНроЯрпИ, рооро░роорпН, роорпБроХроорпН, ро╡ро╛ро┤рпИрокрпНрокро┤роорпН, ро╡ро┐ро▓роЩрпНроХрпБ
ЁЯР╢	adorb, adorbs, animal, dog, pet, puppies, puppy, роЪрпЖро▓рпНро▓рокрпНрокро┐ро░ро╛рогро┐, роиро╛ропрпН, рокрокрпНрокро┐, рокро┐ро░ро╛рогро┐, роорпБроХроорпН, ро╡ро│ро░рпНрокрпНрокрпБрокрпН
ЁЯР╖	animal, bacon, farm, pig, pork, рокройрпНро▒ро┐, роорпБроХроорпН, ро╡ро┐ро▓роЩрпНроХрпБ
ЁЯР╕	animal, frog, родро╡ро│рпИ, роорпБроХроорпН, ро╡ро┐ро▓роЩрпНроХрпБ
ЁЯР╣	animal, hamster, pet, роорпБроХроорпН, ро╡ро┐ро▓роЩрпНроХрпБ, ро╡рпЖро│рпНро│рпЖро▓ро┐
ЁЯР║	animal, wolf, роУроиро╛ропрпН, роорпБроХроорпН, ро╡ро┐ро▓роЩрпНроХрпБ, ро╡рпБро▓рпНроГрокрпН
ЁЯР╗	animal, bear, grizzly, growl, honey, роХро░роЯро┐, роХро░роЯро┐роХрпНроХрпБроЯрпНроЯро┐, роорпБроХроорпН, ро╡ро┐ро▓роЩрпНроХрпБ
ЁЯР╗тАНтЭДя╕П	animal, arctic, bear, polar, white, роЖро░рпНроХрпНроЯро┐роХрпН, роХро░роЯро┐, рокройро┐роХрпН, ро╡рпЖро│рпНро│рпИ
ЁЯР╝	animal, bamboo, panda, роХро░роЯро┐, рокро╛рогрпНроЯро╛, рокро╛ройрпНроЯро╛, роорпБроХроорпН, ро╡ро┐ро▓роЩрпНроХрпБ
ЁЯР╜	animal, farm, nose, pig, smell, snout, рокройрпНро▒ро┐, рокройрпНро▒ро┐ропро┐ройрпН, роорпБроХроорпН, роорпВроХрпНроХрпБ, ро╡ро┐ро▓роЩрпНроХрпБ
ЁЯР╛	feet, paw, paws, print, prints, родроЯроорпН, рокро╛родродрпН, рокро╛родродрпНродроЯроорпН, рокро╛родроорпН, ро╡ро┐ро▓роЩрпНроХро┐ройрпН, ро╡ро┐ро▓роЩрпНроХрпБ
ЁЯСС	clothing, crown, family, king, medieval, queen, royal, royalty, win, роЕрогро┐роХро▓ройрпН, роЕро░роЪро┐, роЖроЯрпИ, роХро┐ро░рпАроЯроорпН, роороХрпБроЯроорпН, ро░родрпНродро┐ройроорпН, ро░ро╛роЬрпНроЬро┐ропроорпН, ро░ро╛роЬрпНропроорпН, ро░ро╛рогро┐
ЁЯСТ	clothe, clothes, clothing, garden, hat, hats, party, woman, роЕрогро┐роХро▓ройрпН, роЖроЯрпИ, родрпКрокрпНрокро┐, рокро╛ро░рпНроЯрпНроЯро┐, рокрпЖрогрпНроХро│рпН, ро╣рпЗроЯрпН
ЁЯСУя╕П	clothing, eye, eyeglasse, eyeglasses, eyewear, glasse, glasses, роЕрогро┐роХро▓ройрпН, роЖроЯрпИ, роХрогрпН, роХрогрпНрогро╛роЯро┐, роХрогрпНрогро╛роЯро┐роХро│рпН, роХро┐ро│ро╛ро╕рпН, роХрпЛроЯрпИ, рокро╛ро░рпНро╡рпИ, роорпВроХрпНроХрпБ, роорпВроХрпНроХрпБроХрпН
ЁЯСФ	clothing, employed, necktie, seriou, serious, shirt, tie, роГрокро╛ро░рпНрооро▓рпН, роЕрогро┐роХро▓ройрпН, роЕро▓рпБро╡ро▓роХроорпН, роЖроЯрпИ, роХро┤рпБродрпНродрпБ, роЪро░рпНроЯрпН, роЯрпИ, родрпБрогро┐, рокрогро┐, ро╡рпЗро▓рпИ, ро╖ро░рпНроЯрпН
ЁЯСХ	blue, casual, clothe, clothes, clothing, collar, dressed, shirt, shopping, tshirt, weekend, роЕрогро┐роХро▓ройрпН, роЖроЯрпИ, роЖрогрпН, роЙроЯрпИ, роХро╛ро▓ро░рпН, роХрпЗро╖рпБро╡ро▓рпН, роЪроЯрпНроЯрпИ, роЪро░рпНроЯрпН, роЯро┐, роЯро┐ро░рпЖро╕рпН, роорпЗро▓ро╛роЯрпИ, ро╖ро░рпНроЯрпН, ро╖ро╛рокрпНрокро┐роЩрпН
ЁЯСЦ	blue, casual, clothe, clothes, clothing, denim, dressed, jean, jeans, pant, pants, shopping, trouser, trousers, weekend, роЖроЯрпИ, роЖроЯрпИроХро│рпН, роЙроЯрпИ, роХро╛ро▒рпНроЪроЯрпНроЯрпИ, роЬрпАройрпНро╕рпН, роЯро┐ро░ро╡рпБроЪро░рпН, роЯро┐ро░ро╡рпБроЪро░рпНро╕рпН, роЯро┐ро░рпЖро╕рпН, роЯрпЖройро┐роорпН, рокрпЗройрпНроЯрпН
ЁЯСЧ	clothe, clothes, clothing, dres, dress, dressed, fancy, shopping, роГрокро┐ро░ро╛роХрпН, роЖроЯрпИ, роЙроЯрпИ, роХро╡рпБройрпН, роЯро┐ро░рпЖро╕рпН, рокрпЖрогрпНроХро│рпН, ро╖ро╛рокрпНрокро┐роЩрпН
ЁЯСШ	clothing, comfortable, kimono, роЕрогро┐роХро▓ройрпН, роЖроЯрпИ, роЙроЯрпИ, роЙроЯрпИроХро│рпН, роХро┐роорпЛройрпЛ, роЬрокрпНрокро╛ройро┐роп, рокрпЖрогрпН
