emoji	keywords
тМЪя╕П	clock, time, watch, роХроЯро┐роХро╛ро░роорпН, роирпЗро░роорпН, ро╡ро╛роЯрпНроЪрпН
тМЫя╕П	done, hourglas, hourglass, sand, time, timer, роХроЯро┐роХро╛ро░роорпН, роирпЗро░роорпН, роорогро▒рпНроХроЯро┐роХро╛ро░роорпН, роорогро▓рпН
тП░я╕П	alarm, clock, hour, hours, hrs, late, time, waiting, роЕро▓ро╛ро░, роЕро▓ро╛ро░роорпН, роХроЯро┐роХро╛ро░роорпН, роорпЗроЪрпИ
тП│я╕П	done, flowing, hour, hourglas, hourglass, hours, not, sand, timer, waiting, yolo, роХроЯро┐роХро╛ро░роорпН, роХро╛ро▓роХрпНроХрпЖроЯрпБ, роЪро░ро┐ропрпБроорпН, роирпЗро░роорпН, роорогро▒рпНроХроЯро┐роХро╛ро░роорпН, роорогро▓рпБроЯройрпН, ропрпЛро▓рпЛ
тШФя╕П	clothing, drop, drops, rain, umbrella, weather, роХрпБроЯрпИ, родрпБро│ро┐, родрпБро│ро┐роХро│рпБроЯройрпН, рооро┤рпИ, рооро┤рпИродрпН
тШХя╕П	beverage, cafe, caffeine, chai, coffee, drink, hot, morning, steaming, tea, роХро╛рокро┐, роХро╛рокро┐роЯрпЗ, роЪрпВроЯро╛рой, роЯрпА, рокро╛ройроорпН, ро╕рпНроЯро╛ро░рпНрокроХрпНро╕рпН
тЪУя╕П	anchor, ship, tool, роЖроЩрпНроХро░рпН, роХроЯро▓рпН, роХрокрпНрокро▓рпН, роХро░рпБро╡ро┐, роироЩрпНроХрпВро░роорпН
тЪбя╕П	danger, electric, electricity, high, lightning, nature, thunder, thunderbolt, voltage, zap, роЕрокро╛ропроорпН, роЗроЯро┐, роЙропро░рпН, роЪро┐ройрпНройроорпН, рооро┐ройрпНроЪро╛ро░роорпН, рооро┐ройрпНройродро┐ро░рпНро╡рпБ, рооро┐ройрпНройро▓рпН, рооро┐ройрпНройро┤рпБродрпНрод, рооро┐ройрпНройро┤рпБродрпНродроорпН
тЪ╜я╕П	ball, football, futbol, soccer, sport, роХро╛ро▓рпНрокроирпНродрпБ, роЪро╛роХрпНроХро░рпН, роорпЖро╕рпНро╕ро┐, ро░рпКройро╛ро▓рпНроЯрпЛ, ро╡ро┐ро│рпИропро╛роЯрпНроЯрпБ
тЪ╛я╕П	ball, baseball, sport, рокроирпНродрпБ, рокрпЗро╕рпНрокро╛ро▓рпН, ро╡ро┐ро│рпИропро╛роЯрпНроЯрпБ
тЫДя╕П	cold, man, snow, snowman, роЗро▓рпНро▓ро╛род, роХро╛ро░рпНроЯрпНроЯрпВройрпН, роХрпБро│ро┐ро░рпНроХро╛ро▓роорпН, рокройро┐, рокройро┐рокрпНрокрпКро┤ро┐ро╡рпБ, рооройро┐родройрпН, ро╡рпЖрокрпНрокроиро┐ро▓рпИ, ро╕рпНроирпЛроорпЗройрпН, ро╕рпНройрпЛроорпЗройрпН
тЫЕя╕П	behind, cloud, cloudy, sun, weather, роЗропро▒рпНроХрпИ, роХро╛роЯрпНроЪро┐, роЪрпВро░ро┐ропройрпИ, роЪрпВро░ро┐ропройрпН, рокро┐ройрпНройро╛ро▓рпН, рокрпЛройрпНро▒, рооро▒рпИроирпНродро┐ро░рпБроХрпНроХрпБроорпН, роорпВроЯро┐ропро┐ро░рпБроХрпНроХрпБроорпН, роорпВроЯро┐ропро┐ро░рпБрокрпНрокродрпБ, роорпЗроХродрпНродро┐ройрпН, роорпЗроХроорпН
тЫУя╕ПтАНЁЯТе	break, breaking, broken, chain, cuff, cuffs, freedom, роЙроЯрпИродрпНродро▓рпН, роЙроЯрпИроирпНрод, роЙроЯрпИрокрпНрокрпБ, роХроГрокрпНро╕рпН, роЪроЩрпНроХро┐ро▓ро┐, роЪрпБродроирпНродро┐ро░роорпН
тЫкя╕П	bles, bless, chapel, christian, church, cros, cross, religion, роЖро▓ропроорпН, роХроЯро╡рпБро│рпН, роХрпЛропро┐ро▓рпН, роЪро┐ро▓рпБро╡рпИ, родрпЗро╡ро╛ро▓ропроорпН, рокро┐ро░ро╛ро░рпНродрпНродройрпИ, роородроорпН
тЫ▓я╕П	fountain, родрпЛроЯрпНроЯроорпН, роирпАро░рпБро▒рпНро▒рпБ, рокрпВроЩрпНроХро╛
тЫ│я╕П	flag, golf, hole, in, sport, роХрпКроЯро┐, роХрпЛро▓рпНроГрокрпН, ро╡ро┐ро│рпИропро╛роЯрпНроЯрпБ
тЫ╡я╕П	boat, resort, sailboat, sailing, sea, yacht, роЙро▓ро╛рокрпН, роХроЯро▓рпН, роЪрпБро▒рпНро▒рпБро▓ро╛, рокроЯроХрпБ, рокропрогроорпН, ро░ро┐роЪро╛ро░рпНроЯрпН
тЫ╣я╕ПтАНтЩАя╕П	athletic, ball, basketball, bouncing, championship, dribble, net, player, throw, woman, роХрпИрокрпНрокроирпНродрпБ, роирокро░рпН, рокроирпНродро╛роЯрпБроорпН, рокроирпНродрпБ, рокро╛ро▓рпН, рокрпЖрогрпН, ро╡ро╛ро▓ро┐, ро╡ро┐ро│рпИропро╛роЯрпНроЯрпБ
тЫ╣я╕ПтАНтЩВя╕П	athletic, ball, basketball, bouncing, championship, dribble, man, net, player, throw, роЖрогрпН, рокроирпНродро╛роЯрпБроорпН, рокроирпНродрпБ, ро╡ро┐ро│рпИропро╛роЯрпНроЯрпБ
тЫ║я╕П	camping, tent, роХрпВроЯро╛ро░роорпН, роХрпЗроорпНрокрпН, роХрпЗроорпНрокрпНрокро┐роЩрпН, рокропро┐ро▒рпНроЪро┐, роорпБроХро╛роорпН
тЫ╜я╕П	diesel, fuel, fuelpump, gas, gasoline, pump, station, роОро░ро┐рокрпКро░рпБро│рпН, роОро░ро┐ро╡ро╛ропрпБ, роХрпЗро╕рпЛро▓ро┐ройрпН, роиро┐ро▓рпИропроорпН, рокроЩрпНроХрпН
тЬия╕П	magic, sparkle, sparkles, star, роТро│ро┐ро░рпБроорпН, роХрпКрогрпНроЯро╛роЯрпНроЯроорпН, роироЯрпНроЪродрпНродро┐ро░роорпН
тнРя╕П	astronomy, medium, star, stars, white, роироЯрпНроЪродрпНродро┐ро░роорпН, роиро┐ро▒, ро╡рпЖро│ро┐ро░рпНроиро┐ро▒, ро╡рпЖро│рпНро│рпИ, ро╕рпНроЯро╛ро░рпН
ЁЯАДя╕П	dragon, game, mahjong, red, роЯро┐ро░ро╛роХройрпН, роЯрпИро▓ро┐ро▓рпН, рооро╣рпНроЬрпЛроЩрпН, ро░рпЖроЯрпН, ро╡ро┐ро│рпИропро╛роЯрпНроЯрпБ
ЁЯГП	card, game, joker, wildcard, роЕроЯрпНроЯрпИропро┐ро▓рпН, роХро░рпБрокрпНрокрпБ, роЪрпАроЯрпНроЯрпБ, роЪрпАроЯрпНроЯрпБроХрпНроХроЯрпНроЯрпБ, роЬрпЛроХрпНроХро░рпН, ро╡рпИро▓рпНроЯрпБроХро╛ро░рпНроЯрпБ
ЁЯМА	cyclone, dizzy, hurricane, twister, typhoon, weather, роГрокро┐ро│ро╛ро╖рпНрокрпЗроХрпН, роХро┐ро▒рпБроХро┐ро▒рпБрокрпНрокрпБ, роЪрпБро┤ро▒рпНроХро╛ро▒рпНро▒рпБ, родро▓рпИроЪрпНроЪрпБро▒рпНро▒ро▓рпН, роиро┐ройрпИро╡рпБ, рокро┤рпИроп, рокро┐ро│ро╛ро╖рпНрокрпЗроХрпН, рокрпБропро▓рпН, рооропроХрпНроХроорпН
ЁЯМБ	fog, foggy, роГрокро╛роХрпН, рокройро┐, рокройро┐рокрпНрокрпБроХрпИ, рокройро┐роорпВроЯрпНроЯроорпН, ро╡рпЖрогрпНрокрпБроХрпИ
ЁЯМВ	closed, clothing, rain, umbrella, роХрпБроЯрпИ, рооро┤рпИ, роорпВроЯро┐роп, ро╡рпЖропро┐ро▓рпН
ЁЯМГ	night, star, stars, роЗро░ро╡ро┐ро▓рпН, роЗро░ро╡рпБ, роироХро░роорпН, роироЯрпНроЪродрпНродро┐ро░роЩрпНроХро│рпН, роироЯрпНроЪродрпНродро┐ро░роорпН, роирпЗро░, рооро┐ро│ро┐ро░рпБроорпН, ро╡ро╛ройроорпН
ЁЯМД	morning, mountain, mountains, over, sun, sunrise, роЙродропроЪрпВро░ро┐ропройрпН, роХро╛ро▓рпИ, роХро╛ро▓рпИроЪрпНроЪрпВро░ро┐ропройрпН, роЪрпВро░ро┐ропрпЛродропроорпН, рооро▓рпИ, ро╡рпЖропро┐ро▓рпН
ЁЯМЕ	morning, nature, sun, sunrise, роЖродро╡ройрпН, роЙродропроорпН, роХроЯро▓рпБроорпН, роХро╛ро▓рпИ, роХро╛ро▓рпИроЪрпНроЪрпВро░ро┐ропройрпН, роЪрпВро░ро┐роп, роЪрпВро░ро┐ропройрпБроорпН, роЪрпВро░ро┐ропройрпН, роЪрпВро░ро┐ропрпЛродропроорпН
ЁЯМЖ	at, building, city, cityscape, dusk, evening, landscape, sun, sunset, роЕро╕рпНродрооройродрпНродро┐ройрпН, роЕро╕рпНродрооройроорпН, роЪрпВро░ро┐роп, роироХро░роорпН, рокрпЛродрпБ, рооро╛ро▓рпИ
ЁЯМЗ	building, dusk, sun, sunset, роЕро╕рпНродрооройроорпН, роЪрпВро░ро┐роп, роироХро░родрпНродро┐ро▓рпН, роирпЗро░, рооро╛ро▓рпИ, роорпБроЯро┐ро╡рпБ, ро╡рпЗро▓рпИ
ЁЯМИ	gay, genderqueer, glbt, glbtq, lesbian, lgbt, lgbtq, lgbtqia, nature, pride, queer, rain, rainbow, tran, trans, transgender, weather, роЗро░рпБрокро╛ро▓ро┐ройродрпНродро╡ро░рпН, роУро░ро┐ройроЪрпНроЪрпЗро░рпНроХрпНроХрпИропро╛ро│ро░рпН, роХрпЗ, ро▓рпЖро╕рпНрокро┐ропройрпН, ро╡рогрпНрогроорпН, ро╡ро╛ройро╡ро┐ро▓рпН
ЁЯМЙ	at, bridge, night, роЗро░ро╡ро┐ройрпН, роЗро░ро╡ро┐ро▓рпН, роЗро░ро╡рпБ, рокро╛ро▓роорпН, рокро┐ройрпНройрогро┐ропро┐ро▓рпН
ЁЯМК	nature, ocean, surf, surfer, surfing, water, wave, роЕро▓рпИ, роУроЪрпИ, роХроЯро▓ро▓рпИ, роХроЯро▓рпН, роЪро░рпНроГрокро┐роЩрпН, роЪрпАро▒рпНро▒роорпН, роирпАро░ро▓рпИ
ЁЯМЛ	eruption, mountain, nature, volcano, роОро░ро┐рооро▓рпИ, роирпЖро░рпБрокрпНрокрпБ, ро▓ро╛ро╡ро╛, ро╡ро▓рпНроХройрпЛ, ро╡рпЖроЯро┐роХрпНроХрпБроорпН, ро╡рпЖроЯро┐рокрпНрокрпБ
ЁЯММ	milky, space, way, роЕрогрпНроЯроорпН, роЗро░ро╡рпБ, рокро╛ро▓рпНро╡ро┤ро┐, рокро┐ро░рокроЮрпНроЪроорпН
ЁЯМНя╕П	africa, earth, europe, globe, showing, world, роЖрокрпНрокро┐ро░ро┐роХрпНроХро╛, роЙро░рпБрогрпНроЯрпИ, роЙро▓роХ, роРро░рпЛрокрпНрокро╛, рокроирпНродрпБ, рокрпВрооро┐
ЁЯМОя╕П	america, americas, earth, globe, showing, world, роЕроорпЖро░ро┐роХрпНроХро╛, роЙро░рпБрогрпНроЯрпИ, роЙро▓роХ, родрпЖройрпН, рокрпВрооро┐, рокрпВрооро┐рокрпНрокроирпНродрпБ, ро╡роЯ
ЁЯМПя╕П	asia, australia, earth, globe, showing, world, роЖроЪро┐ропро╛, роЖро╕рпНродро┐ро░рпЗро▓ро┐ропро╛, роЙро░рпБрогрпНроЯрпИ, роЙро▓роХ, рокрпВрооро┐, рокрпВрооро┐рокрпНрокроирпНродрпБ
ЁЯМР	earth, globe, internet, meridian, meridians, web, world, worldwide, роЕроЯрпНроЪро░рпЗроХрпИ, роЙро░рпБрогрпНроЯрпИ, роЙро▓роХ, родрпАро░рпНроХрпНроХро░рпЗроХрпИ, родрпАро░рпНроХрпНроХро░рпЗроХрпИроХро│рпБроЯройрпН, рокрпВрооро┐
ЁЯМС	dark, moon, new, space, роЕрооро╛ро╡роЪрпИ, роЗро░ро╡рпБ, роЗро░рпБро│рпН, роиро┐ро▓ро╛
ЁЯМТ	crescent, dream, dreams, moon, space, waxing, роЗро░ро╡рпБ, роиро┐ро▓ро╛, рокро┐ро▒рпИроиро┐ро▓ро╡рпБ, ро╡ро│ро░рпНрокро┐ро▒рпИ
ЁЯМУ	first, moon, quarter, space, роЕро░рпИроиро┐ро▓ро╡рпБ, роЕро░рпИрокро╛родро┐, роЗро░ро╡рпБ, роиро┐ро▓ро╛, ро╡ро│ро░рпНрокро┐ро▒рпИ
ЁЯМФ	gibbou, gibbous, moon, space, waxing, роЗро░ро╡рпБ, роиро┐ро▓ро╡рпКро│ро┐, роиро┐ро▓ро╛, рокро┐ро▒рпИроиро┐ро▓ро╡рпБ, роорпБроХрпНроХро╛ро▓рпНрокроХрпБродро┐, ро╡ро│ро░рпНрокро┐ро▒рпИ
ЁЯМХя╕П	full, moon, space, роЗро░ро╡рпБ, роиро┐ро▓ро╡рпКро│ро┐, рокро╡рпБро░рпНрогрооро┐, рокрпМро░рпНрогрооро┐, роорпБро┤рпБроиро┐ро▓ро╡рпБ
ЁЯМЦ	gibbou, gibbous, moon, space, waning, роЗро░ро╡рпБ, роХро╛ро▓рпНрокроХрпБродро┐, родрпЗропрпНрокро┐ро▒рпИ, роиро┐ро▓ро╡рпКро│ро┐, роиро┐ро▓ро╛
ЁЯМЧ	last, moon, quarter, space, роЕро░рпИроиро┐ро▓ро╡рпБ, роЕро░рпИрокро╛родро┐, роЗро░ро╡рпБ, родрпЗропрпНрокро┐ро▒рпИ, роиро┐ро▓ро╛
ЁЯМШ	crescent, moon, space, waning, роЗро░ро╡рпБ, родрпЗропрпНрокро┐ро▒рпИ, роиро┐ро▓ро╛, рокро┐ро▒рпИроиро┐ро▓ро╡рпБ, роорпБроХрпНроХро╛ро▓рпНрокроХрпБродро┐
ЁЯМЩ	crescent, moon, ramadan, space, родрпЗропрпНрокро┐ро▒рпИ, роиро┐ро▓ро╡рпКро│ро┐, роиро┐ро▓ро╛, рокро┐ро▒рпИроиро┐ро▓ро╡рпБ, ро░роородро╛ройрпН, ро░рооро▓ро╛ройрпН, ро░роорпНроЬро╛ройрпН, ро╡ро│ро░рпНрокро┐ро▒рпИ
ЁЯМЪ	moon, new, space, роЕрооро╛ро╡ро╛роЪрпИ, роХро░рпБрокрпНрокрпБ, роиро┐ро▓ро╛, роорпБроХроорпН
ЁЯМЫ	first, moon, quarter, space, роЕро░рпИрокро╛родро┐, роиро┐ро▓ро╛, роорпБроХроорпН, ро╡ро│ро░рпНрокро┐ро▒рпИ
ЁЯМЬя╕П	dream, dreams, last, moon, quarter, роЕро░рпИрокро╛родро┐, родрпЗропрпНрокро┐ро▒рпИ, роиро┐ро▓ро╛, роорпБроХроорпН
ЁЯМЭ	bright, full, moon, роиро┐ро▓ро╛, рокро┐ро░роХро╛роЪроорпН, рокрпМро░рпНрогрооро┐, роорпБроХроорпН, роорпБро┤рпБроиро┐ро▓ро╛
ЁЯМЮ	beach, bright, day, heat, shine, sun, sunny, sunshine, weather, роТро│ро┐, роХроЯро╡рпБро│рпН, роХрпЛроЯрпИ, роЪрпВро░ро┐роп, роЪрпВро░ро┐ропроХрпН, роЪрпВро░ро┐ропройрпН, роорпБроХроорпН, ро╡рпЖрокрпНрокроорпН, ро╡рпЖропро┐ро▓рпН, ро╡рпЖро│ро┐роЪрпНроЪроорпН
ЁЯМЯ	glittery, glow, glowing, night, shining, sparkle, star, win, роТро│ро┐, родро┐ро▒роорпИ, роироЯрпНроЪродрпНродро┐ро░роорпН, ро╡рпАроЪрпБроорпН
ЁЯМа	falling, night, shooting, space, star, роЗро░ро╡рпБ, роОро░ро┐роироЯрпНроЪродрпНродро┐ро░роорпН, роироЯрпНроЪродрпНродро┐ро░роорпН, ро╡ро╛ро▓рпН, ро╡ро┐рогрпНро╡рпЖро│ро┐
ЁЯМн	dog, frankfurter, hot, hotdog, sausage, роЗро▒рпИроЪрпНроЪро┐, роЙрогро╡рпБ, роХрпКродрпНродрпБроХрпНроХро▒ро┐, роЪро╛ро╕рпЗроЬрпН, роЯро╛роХрпН, ро╣ро╛роЯрпН, ро╣ро╛роЯрпНроЯро╛роХрпН
ЁЯМо	mexican, taco, роЙрогро╡рпБ, роЯро╛роХрпЛ, роорпЖроХрпНроЪро┐роХройрпН, роорпЖроХрпНро╕ро┐роХройрпН
ЁЯМп	burrito, mexican, wrap, роЙрогро╡рпБ, роХродрпНродро┐, роЪрокрпНрокро╛родрпНродро┐, рокро░ро┐роЯрпНроЯрпЛ, рокрпБро░ро┐роЯрпНроЯрпЛ, роорпЖроХрпНроЪро┐роХройрпН, роорпЖроХрпНро╕ро┐роХройрпН, ро░рпЛро▓рпН
ЁЯМ░	almond, chestnut, plant, роЙрогро╡рпБ, роЪрпЖро╕рпНроЯрпНроироЯрпН, роироЯрпНро╕рпН, рокро╛родро╛роорпН, ро╡ро▒рпБродрпНрод
ЁЯМ▒	plant, sapling, seedling, sprout, young, роЪрпЖроЯро┐, родрпКроЯроХрпНроХроорпН, рокрпБродро┐роп, роорпБро│рпИ, роорпБро│рпИроХрпНроХрпБроорпН, ро╡ро│ро░рпНроЪрпНроЪро┐
ЁЯМ▓	christma, christmas, evergreen, forest, pine, tree, роЕроЪрпЛроХ, роХро╛ро▓роорпН, роХро┐ро▒ро┐ро╕рпНродрпБрооро╕рпН, рокроЪрпБроорпИ, рокрпИройрпН, рооро░роорпН
ЁЯМ│	deciduou, deciduous, forest, green, habitat, shedding, tree, роЗро▓рпИропрпБродро┐ро░рпН, роХро╛роЯрпБ, рокроЪрпБроорпИ, рооро░роорпН
ЁЯМ┤	beach, palm, plant, tree, tropical, роХроЯро▒рпНроХро░рпИ, роХрпЗро│ро┐роХрпНроХрпИ, рокройрпИ, рокрпАроЪрпН, рооро░роорпН, ро╡ро┐роЯрпБроорпБро▒рпИ
ЁЯМ╡	cactu, cactus, desert, drought, nature, plant, роХро▒рпНро▒ро╛ро┤рпИ, роХро│рпНро│ро┐, роЪрокрпНрокро╛родрпНродро┐, роЪрпЖроЯро┐, рокро╛ро▓рпИро╡ройроорпН
ЁЯМ╖	blossom, flower, growth, plant, tulip, роЗро▓рпИроХро│рпН, роЪрпЖроЯро┐, роЯрпНропрпБро▓ро┐рокрпН, рокрпВ, рокрпВро╡ро░роЪрпБ, рооро▓ро░рпН, ро░рпЛроЬро╛, ро░рпЛро╕рпН
ЁЯМ╕	blossom, cherry, flower, plant, spring, springtime, роХро╛ро▓роорпН, роЪрпЖро░рпНро░ро┐, роЪрпЖро░рпНро░ро┐рокро┐ро▓ро╛ро╕роорпН, рокро┐ро▓ро╛ро╕роорпН, рооро▓ро░рпН, ро╡роЪроирпНрод, ро╡роЪроирпНродроорпН
ЁЯМ╣	beauty, elegant, flower, love, plant, red, rose, valentine, роХро╛родро▓рпН, роЪро┐ро╡рокрпНрокрпБ, рооро▓ро░рпН, ро░рпЛроЬро╛
ЁЯМ║	flower, hibiscu, hibiscus, plant, роЪрпЖроорпНрокро░рпБродрпНродро┐, рокрпВ, рооро▓ро░рпН
ЁЯМ╗	flower, outdoor, outdoors, plant, sun, sunflower, роЪрпВро░ро┐ропроХро╛роирпНродро┐, роЪрпВро░ро┐ропройрпН, рокрпВ, рооро▓ро░рпН
ЁЯМ╝	blossom, buttercup, dandelion, flower, plant, роЯрпЗройрпНроЯрпЗро▓ро┐ропройрпН, рокро┐ро▓ро╛ро╕роорпН, роороЮрпНроЪро│рпН, рооро▓ро░рпН
ЁЯМ╜	corn, crop, crops, ear, farm, maize, maze, of, роЙрогро╡рпБ, роХро╛ро░рпНройрпН, роЪрпЛро│роХрпНроХродро┐ро░рпН, роЪрпЛро│роорпН, рокро╛рокрпНроХро╛ро░рпНройрпН, роороХрпНроХро╛роЪрпНроЪрпЛро│роорпН, ро╕рпНро╡рпАроЯрпНроХро╛ро░рпНройрпН
ЁЯМ╛	ear, grain, grains, of, plant, rice, sheaf, роЕро░ро┐роЪро┐, роЕро▒рпБро╡роЯрпИ, роирпЖро▒рпНроХродро┐ро░рпН, роирпЖро▓рпН, ро╡ропро▓рпН
ЁЯМ┐	herb, leaf, plant, роЗро▓рпИ, роЗро▓рпИроХро│рпН, роЪрпЖроЯро┐, рокроЪрпБроорпИ, рокроЪрпНроЪрпИ, рооро░рпБроирпНродрпБ, роорпВро▓ро┐роХрпИ
ЁЯНА	clover, four, irish, leaf, lucky, plant, роЕродро┐ро░рпНро╖рпНроЯроорпН, роЗро▓рпИ, роЗро▓рпИроХро│рпН, роХро┐ро│ро╛ро╡ро░рпН, роХро┐ро│рпЛро╡ро░рпН, роХрпНро│рпЛро╡ро░рпН, роиро╛ройрпНроХрпБ
ЁЯНБ	falling, leaf, maple, роЗро▓рпИ, роЗро▓рпИропрпБродро┐ро░рпН, роЗро▓рпИропрпБродро┐ро░рпНроХро╛ро▓роорпН, роорпЗрокрпНрокро┐ро│рпН
ЁЯНВ	autumn, fall, fallen, falling, leaf, роЗро▓рпИроХро│рпН, роЗро▓рпИропрпБродро┐ро░рпН, роЗро▓рпИропрпБродро┐ро░рпНроХро╛ро▓роорпН, роЙродро┐ро░рпБроорпН, ро╡ро▒роЯрпНроЪро┐
ЁЯНГ	blow, flutter, fluttering, in, leaf, wind, роЖроЯрпБроорпН, роЗро▓рпИроХро│рпН, роЗро▓рпИропрпБродро┐ро░рпНроХро╛ро▓роорпН, роЙродро┐ро░рпБроорпН, роХро╛ро▒рпНро▒ро┐ро▓рпН, рокроЪрпБроорпИ
ЁЯНД	fungu, fungus, mushroom, toadstool, роЙрогро╡рпБ, роХро╛ро│ро╛ройрпН, роЪрпВрокрпНрокро░рпН, роиро╛ропрпНроХрпНроХрпБроЯрпИ, рооро╖рпНро░рпВроорпН, рооро╛ро░ро┐ропрпЛ
ЁЯНДтАНЁЯЯл	brown, food, fungi, fungu, fungus, mushroom, nature, pizza, portobello, shiitake, shroom, spore, sprout, topping, toppings, truffle, vegetable, vegetarian, veggie, роЗропро▒рпНроХрпИ, роЙрогро╡рпБ, роХро╛ропрпНроХро▒ро┐, роХро╛ро│ро╛ройрпН, роЪрпИро╡, роЯро╛рокрпНрокро┐роЩрпН, роиро┐ро▒, рокро┤рпБрокрпНрокрпБ, рокрпАроЯрпНроЪро╛, рокрпВроЮрпНроЪрпИ
ЁЯНЕ	food, fruit, tomato, vegetable, роЙрогро╡рпБ, роХро╛ропрпН, роХро╛ропрпНроХро▒ро┐, родроХрпНроХро╛ро│ро┐, рокро┤роорпН
ЁЯНЖ	aubergine, eggplant, vegetable, роЙрогро╡рпБ, роХродрпНродро░ро┐, роХродрпНродро░ро┐роХрпНроХро╛ропрпН, роХро╛ропрпН, роХро╛ропрпНроХро▒ро┐
ЁЯНЗ	dionysu, dionysus, fruit, grape, grapes, роЙрогро╡рпБ, роТропро┐ройрпН, родро┐ро░ро╛роЯрпНроЪрпИ, рокро┤роорпН, рокро┤ро░роЪроорпН
